2913,25679,200303180007,2003,3,18,,0,,4,Afghanistan,6,South Asia,Nangarhar,Jalalabad,34.434166999999995,70.447778,1.0,0,,"03/18/2003: A bomb exploded at the home of senior government official Malik Mohammed Nazeer in Jalalabad, Afghanistan, causing no injuries, but slightly damaging his house. Bombs were planted on the roof of Nazeer's home and police defused at least one other bomb before it exploded. Authorities suspected al-Qa`ida and the Taliban.",1,1,1,0,,,0,1,0,3,Bombing/Explosion,,,,,2,Government (General),18.0,"Government Personnel (excluding police, military)",Afghan bureaucrat,Malik Mohammed Nazeer,4.0,Afghanistan,,,,,,,,,,,,,,,,,Al-Qa`ida,,Taliban,,,,Unknown,1.0,1.0,,,0.0,0.0,,,0.0,,,,,,,6,Explosives/Bombs/Dynamite,16.0,Unknown Explosive Type,,,,,,,,,,,,,,0.0,0.0,0.0,0.0,0.0,0.0,1,3.0,Minor (likely < $1 million),,The explosion slightly damaged Nazeer's home and shattered windows of nearby homes.,0.0,,,,,,,,,,,,,,,,,"“Afghans Officials Visits Scene of Bomb Blast in Eastern City,” Radio Nangarhar, March 19, 2003.","“Bomb Explodes at Home of Afghan Official,” Associated Press, March 18, 2003.",,CETIS,0,1,0,1,
2914,25688,200303200003,2003,3,20,,0,,4,Afghanistan,6,South Asia,Kandahar,Kandahar,31.617667,65.675942,1.0,0,,"03/20/2003: A bomb, hidden in a drainage ditch, exploded in Kandahar, Afghanistan, injuring no one. Police found and defused a second bomb, blaming al-Qa`ida and the Taliban for both bombs.",1,1,1,0,,,0,1,0,3,Bombing/Explosion,,,,,14,Private Citizens & Property,67.0,Unnamed Civilian/Unspecified,Civilians,"Civilians in Kandahar, Afghanistan",4.0,Afghanistan,9.0,Food or Water Supply,52.0,Water Supply,,"Drainage ditch in Kandahar, Afghanistan",4.0,Afghanistan,,,,,,,,,Al-Qa`ida,,Taliban,,,,Unknown,1.0,1.0,,,0.0,0.0,,,0.0,,,,,,,6,Explosives/Bombs/Dynamite,16.0,Unknown Explosive Type,,,,,,,,,,,,,,0.0,0.0,0.0,0.0,0.0,0.0,0,,,,,0.0,,,,,,,,,,,,,,,,,"“Bomb Explodes in Southern Kandahar, Another Found and Defused: Police,” Associated Press, March 20, 2003.","Zaffar Abbas, “US Forces Target Taliban Massing Near Kandahar: Gunships Back 1,000 Soldiers in Assault on Caves,” The Guardian, March 21, 2003.",,CETIS,0,1,0,1,
2917,25699,200303220003,2003,3,22,,0,,4,Afghanistan,6,South Asia,Balkh,Mazari Sharif district,36.7,67.116667,3.0,0,,"03/22/2003: Two rockets were fired from the Ghor-i-Maar area at an airport in Mazari Sharif, Afghanistan, injuring no one. It was unclear if the airport was damaged. Four supporters of warlord Gulbuddin Hekmatyar were arrested for the attack, which the Afghan military said was to disrupt celebrations for Afghanistan's March 21 new year.",1,1,1,0,,,0,1,0,3,Bombing/Explosion,,,,,6,Airports & Aircraft,44.0,Airport,Afghan airport,"Airport in Mazari Sharif, Afghanistan",4.0,Afghanistan,,,,,,,,,,,,,,,,,Hizb-I-Islami,,,,,,Afghan military said the attack was to disrupt celebrations for Afghanistan's March 21 new year.,0.0,,,,0.0,0.0,,,,,,,,,,6,Explosives/Bombs/Dynamite,11.0,"Projectile (rockets, mortars, RPGs, etc.)",,,,,,,,,,,,,Two rockets were fired.,0.0,0.0,0.0,0.0,0.0,0.0,-9,,,,Sources conflicted+CX182 on whether the rockets damaged the airport.,0.0,,,,,,,,,,,,,,,,Gulbuddin Hekmatyar was the leader of political party Hizb-e Islami.,"“Mazar-e Sharif Airport Comes Under Rocket Attack,” Hindokosh, March 22, 2003.","“Four Arrested for Rocket Attack on Afghan Airport,” Agence France Presse, March 23, 2003.","“Northern Afghan Official Accuses Hekmatyar of Failed Rocket Attacks,” Balkh TV, March 24, 2003.",CETIS,0,0,0,0,
2918,25700,200303220004,2003,3,22,,0,,4,Afghanistan,6,South Asia,Kandahar,Spin Boldak,31.008056,66.39805600000001,1.0,1,This attack occurred about 15-20 miles from Spin Boldak.,"03/22/2003: Three Afghan soldiers were killed and at least one more injured in an attack on the Wath army post near Spin Boldak, Afghanistan. Members of the Taliban, Al-Qa`ida and Hizb-e-Islami were suspected in the attack, but no one claimed responsibility.",1,1,1,1,1.0,Insurgency/Guerilla Action,0,1,0,2,Armed Assault,,,,,4,Military,27.0,Military Barracks/Base/Headquarters/Checkpost,Afghan National Army (ANA),Wath Army Post,4.0,Afghanistan,,,,,,,,,,,,,,,,,Taliban,,Al-Qa`ida,,Hizb-I-Islami,,Unknown,1.0,1.0,1.0,,0.0,0.0,,,0.0,,,0.0,,,,5,Firearms,5.0,Unknown Gun Type,,,,,,,,,,,,,,3.0,0.0,0.0,1.0,0.0,0.0,0,,,,,0.0,,,,,,,,,,,,,,,,,"“Al-Qa’ida Kill Three Afghan Troops in South,” Voice of the Islamic Republic of Iran, March 23, 2003.","“Three Soldiers Killed in Rebel Raid in Southern Afghanistan,” Agence France Presse, March 22, 2003.","“Three Afghan Army Soldiers Dead in Suspected Taliban, Hizb-e-Islami Attack, Official Says,” Associated Press, March 22, 2003.",CETIS,0,1,0,1,
2920,25723,200303250003,2003,3,25,,0,,4,Afghanistan,6,South Asia,Paktia,Shakin,32.526124,69.256501,1.0,0,,"03/25/2003: Anti-American rebels fired eleven rockets at a U.S. military base in Shkin, Afghanistan, causing no injuries or damage after the rockets landed away from the base. Authorities said Taliban and other anti-American rebels had promised to increase attacks in response to a U.S. led invasion of Iraq.",1,1,1,1,1.0,Insurgency/Guerilla Action,0,1,0,3,Bombing/Explosion,,,,,4,Military,27.0,Military Barracks/Base/Headquarters/Checkpost,North Atlantic Treaty Organization (NATO): International Security Assistance Force (ISAF),United States military base,422.0,International,,,,,,,,,,,,,,,,,Other,,,,,,Authorities said Taliban and other anti-American rebels had promised to increase attacks in response to a U.S. led invasion of Iraq.,0.0,,,,0.0,0.0,,,,,,,,,,6,Explosives/Bombs/Dynamite,11.0,"Projectile (rockets, mortars, RPGs, etc.)",,,,,,,,,,,,,,0.0,0.0,0.0,0.0,0.0,0.0,0,,,,,0.0,,,,,,,,,,,,,,,,,"Jamey Keaten, “Rebels Fire 14 Rockets at U.S. bases in Afghanistan, Injuring No One,” Associated Press, March 26, 2003.","Carlotta Gall, “U.S. Bases Hit in Afghanistan; 2nd Major Attack Since Beginning of War in Iraq,” International Herald Tribune, March 27, 2003.",,CETIS,-9,-9,1,1,
2921,25724,200303250004,2003,3,25,,0,,4,Afghanistan,6,South Asia,Khost,Khost,33.331806,69.951693,1.0,0,,"03/25/2003: Unknown perpetrators fired a rocket at the coalition-controlled airport in Khost, Afghanistan, causing no injuries or damage.",1,1,1,1,1.0,Insurgency/Guerilla Action,0,1,0,3,Bombing/Explosion,,,,,4,Military,37.0,NATO,North Atlantic Treaty Organization (NATO): International Security Assistance Force (ISAF),Air base,422.0,International,,,,,,,,,,,,,,,,,Unknown,,,,,,Unknown,0.0,,,,0.0,0.0,,,,,,,,,,6,Explosives/Bombs/Dynamite,11.0,"Projectile (rockets, mortars, RPGs, etc.)",,,,,,,,,,,,,A rocket was used in the attack,0.0,0.0,0.0,0.0,0.0,0.0,0,,,,,0.0,,,,,,,,,,,,,,,,,"“Rocket Fired Toward Coalition Base in Eastern Afghanistan,” Associated Press, March 25, 2003.",,,CETIS,-9,-9,1,1,
2922,25729,200303260004,2003,3,26,,0,,4,Afghanistan,6,South Asia,Kandahar,Kandahar,31.617667,65.675942,1.0,0,,"03/26/2003: A bomb blew up a tank carrying fuel en route to a U.S. military base in Kandahar, Afghanistan. No one was injured and Afghan authorities blamed the Taliban or loyalists of Afghan warlord Gulbuddin Hekmatyar.",1,1,1,1,1.0,Insurgency/Guerilla Action,0,1,0,3,Bombing/Explosion,,,,,4,Military,37.0,NATO,North Atlantic Treaty Organization (NATO): International Security Assistance Force (ISAF),Fuel tanker,422.0,International,,,,,,,,,,,,,,,,,Taliban,,Hizb-I-Islami,,,,Unknown,1.0,1.0,,,0.0,0.0,,,0.0,,,,,,,6,Explosives/Bombs/Dynamite,16.0,Unknown Explosive Type,,,,,,,,,,,,,,0.0,0.0,0.0,0.0,0.0,0.0,1,3.0,Minor (likely < $1 million),,The fuel tanker was destroyed.,0.0,,,,,,,,,,,,,,,,Loyalists of Afghan warlord Gulbuddin Hekmatyar were also named as possible perpetrators.,"Noor Khan, “Suspected Terrorist Blast Burns Pakistani Oil Truck Near U.S. Base in Afghanistan,” Associated Press, March 27, 2003.",,,CETIS,0,1,1,1,
2924,25731,200303260006,2003,3,26,,0,,4,Afghanistan,6,South Asia,Paktia,Gardez,33.6,69.216944,1.0,0,,"03/26/2003: Anti-American rebels fired three rockets at the U.S. military base in Gardez, Afghanistan, causing no injuries or damage after the rockets landed away from the base. Authorities said Taliban and other anti-American rebels had promised to increase attacks in response to a U.S. led invasion of Iraq.",1,1,1,1,1.0,Insurgency/Guerilla Action,0,1,0,3,Bombing/Explosion,,,,,4,Military,37.0,NATO,North Atlantic Treaty Organization (NATO): International Security Assistance Force (ISAF),United States base,422.0,International,,,,,,,,,,,,,,,,,Other,,,,,,Authorities said Taliban and other anti-American rebels had promised to increase attacks in response to a U.S. led invasion of Iraq.,0.0,,,,0.0,0.0,,,,,,,,,,6,Explosives/Bombs/Dynamite,11.0,"Projectile (rockets, mortars, RPGs, etc.)",,,,,,,,,,,,,Three rockets were used in the attack.,0.0,0.0,0.0,0.0,0.0,0.0,0,,,,,0.0,,,,,,,,,,,,,,,,,"“Afghan Rebels Fire Rockets on US Military Base in Paktia Province,” Voice of the Islamic Republic of Iran, March 27, 2003.","Jamey Keaten, “Rebels Fire 14 Rockets at U.S. bases in Afghanistan, Injuring No One,” Associated Press, March 26, 2003.","Carlotta Gall, “U.S. Bases Hit in Afghanistan; 2nd Major Attack Since Beginning of War in Iraq,” International Herald Tribune, March 27, 2003.",CETIS,-9,-9,1,1,
2929,25752,200303290003,2003,3,29,,0,,4,Afghanistan,6,South Asia,Nangarhar,Jalalabad,34.434166999999995,70.447778,1.0,0,,"03/29/2003: Rockets were fired at the U.S. military base at the airport in Jalalabad, Afghanistan, injuring no one, but causing damage to the runway and nearby facilities of the Afghan Army. In separate pamphlets found in Jalalabad, Saif-ul-Muslimeen and Lashkar-e-Fidayan-e-Islam claimed responsibility for the attack, adding that it was aimed at the Americans.",1,1,1,1,1.0,Insurgency/Guerilla Action,0,1,0,3,Bombing/Explosion,,,,,4,Military,37.0,NATO,North Atlantic Treaty Organization (NATO): International Security Assistance Force (ISAF),United States soldiers,422.0,International,,,,,,,,,,,,,,,,,Saif-ul-Muslimeen,,Lashkar-e-Fidayan-e-Islam,,,,Unknown,0.0,0.0,,,0.0,1.0,9.0,Other,1.0,9.0,Other,,,,-9.0,6,Explosives/Bombs/Dynamite,11.0,"Projectile (rockets, mortars, RPGs, etc.)",,,,,,,,,,,,,,0.0,0.0,0.0,0.0,0.0,0.0,1,3.0,Minor (likely < $1 million),,"A rocket damaged the wall of the army facility and shattered windows, while another rocket made a small crater in the runway at the airport.",0.0,,,,,,,,,,,,,,,,"Two groups, Saif al-Mujahedeen al-Islam and Lashkar-e-Fidayan-e-Islam, claimed responsibility for the attacks in separate pamphlets found in Jalalabad,.","“Jalalabad Airport Comes Under Missile Attack,” Radio Afghanistan, March 30, 2003.","“Two Rockets Fired at Jalalabad Airport,” Afghan Islamic Press, March 30, 2003.","Janullah Hashimzada, “Suspected Taliban Fighters Fire Rockets at Afghan Air Base, Military Division,” Associated Press, March 30, 2003.",CETIS,0,1,1,1,
2930,25757,200303300002,2003,3,30,,0,,4,Afghanistan,6,South Asia,Kabul,Kabul,34.533056,69.166111,1.0,0,,"03/30/2003: Extremists linked to Afghan warlord Gulbuddin Hekmatyar were suspected of firing a rocket at the headquarters of the International Security Assistance Force (ISAF), slightly damaging the compound. The perpetrators fired another rocket into the Pul-e-Charkhi area. There were no injuries reported in either related attack.",1,1,1,0,,,1,1,0,3,Bombing/Explosion,,,,,4,Military,37.0,NATO,North Atlantic Treaty Organization (NATO): International Security Assistance Force (ISAF),Headquarters,422.0,International,,,,,,,,,,,,,,,,,Hizb-I-Islami,,,,,,Unknown,1.0,,,,0.0,0.0,,,,,,,,,,6,Explosives/Bombs/Dynamite,11.0,"Projectile (rockets, mortars, RPGs, etc.)",,,,,,,,,,,,,A 122 mm rocket was used in the attack.,0.0,0.0,0.0,0.0,0.0,0.0,1,3.0,Minor (likely < $1 million),,The rocket slightly damaged the ISAF compound.,0.0,,,,,,,,,,,,,,,,,"“ISAF Compound Hit in Kabul Rocket Attack, No Casualties Reported,” Agence France Presse, March 30, 2003.","Amir Shah, “Rocket Hits Peacekeepers HQ in Kabul,” Associated Press, March 30, 2003.","“Hekmatyar Suspected of Role in Attack on Peacekeepers in Afghanistan,” Agence France Presse, March 31, 2003.",CETIS,0,1,1,1,200303300006
2931,25761,200303300006,2003,3,30,,0,,4,Afghanistan,6,South Asia,Kabul,Kabul,34.533056,69.166111,1.0,0,,"03/30/2003: Extremists linked to Afghan warlord Gulbuddin Hekmatyar were suspected of firing a rocket into the Pul-e-Charkhi area in Kabul, Afghanistan. The perpetrators fired another rocket at the headquarters of the International Security Assistance Force (ISAF), slightly damaging the compound. There were no injuries reported in either related attack.",1,1,1,0,,,1,1,0,3,Bombing/Explosion,,,,,20,Unknown,,,Unknown,"Unspecified target in the Pul-e-Charkhi area in Kabul, Afghanistan",4.0,Afghanistan,,,,,,,,,,,,,,,,,Hizb-I-Islami,,,,,,Unknown,1.0,,,,0.0,0.0,,,,,,,,,,6,Explosives/Bombs/Dynamite,11.0,"Projectile (rockets, mortars, RPGs, etc.)",,,,,,,,,,,,,A 122 mm rocket was used in the attack.,0.0,0.0,0.0,0.0,0.0,0.0,0,,,,,0.0,,,,,,,,,,,,,,,,,"“ISAF Compound Hit in Kabul Rocket Attack, No Casualties Reported,” Agence France Presse, March 30, 2003.","Amir Shah, “Rocket Hits Peacekeepers HQ in Kabul,” Associated Press, March 30, 2003.","“Hekmatyar Suspected of Role in Attack on Peacekeepers in Afghanistan,” Agence France Presse, March 31, 2003.",CETIS,0,0,0,0,200303300002
2932,25773,200304030006,2003,4,3,,0,,4,Afghanistan,6,South Asia,Badghis,Bala Murghab,35.5938,63.335419,1.0,0,,"04/03/2003: At least 150 Taliban fighters attacked a government military base in Bala Morghab, Afghanistan. Two Taliban members and five soldiers died in the exchange of fire. Eight Taliban members were arrested by government forces.",1,1,1,1,1.0,Insurgency/Guerilla Action,0,1,0,2,Armed Assault,,,,,4,Military,27.0,Military Barracks/Base/Headquarters/Checkpost,Afghan National Security Force (ANSF),Base,4.0,Afghanistan,,,,,,,,,,,,,,,,,Taliban,,,,,,Unknown,1.0,,,150.0,8.0,0.0,,,,,,,,,,5,Firearms,2.0,Automatic Weapon,,,,,,,,,,,,,,7.0,0.0,2.0,,0.0,,-9,,,,,0.0,,,,,,,,,,,,,,,,,"""Seven Killed in clash between Taliban, Afghan forces in Badghis Province,"" Kabul Erada, April 3, 2003.",,,CETIS,0,0,0,0,
2933,25774,200304040001,2003,4,4,,0,,4,Afghanistan,6,South Asia,Uruzgan,Mian Daw,32.6525,65.486944,1.0,0,,"04/04/2003: Mullah Jailani and one of his nephews were assassinated by the Taliban as they were coming out of their house in the Miandaw village, Southern Oruzgan, Afghanistan. Mullah Jailani was a close friend of President Hamid Karzai and together they organized forces in the country against the Taliban. It was uncertain what type of weapon was used in the assassination. No one had openly claimed responsibility for the attack.",1,1,1,0,,,0,1,0,1,Assassination,,,,,14,Private Citizens & Property,68.0,Named Civilian,Friend of President Hamid Karzai,Mullah Jailani,4.0,Afghanistan,,,,,,,,,,,,,,,,,Taliban,,,,,,Unknown,1.0,,,,0.0,0.0,,,,,,,,,,5,Firearms,5.0,Unknown Gun Type,,,,,,,,,,,,,,2.0,0.0,0.0,0.0,0.0,,0,,,,,0.0,,,,,,,,,,,,,,,,In 2001 Karzai came back to Afghanistan to mobilize the resistance against the Taliban and at the time Jailani was said to have helped him a great deal.,""" AFP: Uruzgan Governor Says Friend of Afghan President Shot by Suspected Taliban,"" Hong Kong AFP, April 4, 2003.","""Friend of President Karzai gunned down in southern Afghanistan,"" Agence France Presse, April 4, 2003.",,CETIS,0,0,0,0,
2934,25793,200304120001,2003,4,12,,0,,4,Afghanistan,6,South Asia,Zabul,Shahjoy district,32.50281,67.415452,3.0,1,"The incident occurred near Shahjoy, Afghanistan.","04/12/2003: An Italian tourist believed to be Orfeo Bartolini was shot and killed by two suspected Taliban militants near Shahjoy, Afghanistan. Bartolini had arrived in the country and hired a car and driver without informing authorities. While en route to Kabul, two men on a motorbike stopped his car and killed Bartolini, but allowed the driver to live.",1,1,1,0,,,0,1,0,2,Armed Assault,,,,,18,Tourists,97.0,Tourist,Civilians,"Orfeo Bartolini, an Italian tourist traveling from Qalat to Kabul, Afghanistan",98.0,Italy,,,,,,,,,,,,,,,,,Taliban,,,,,,Unknown,1.0,,,2.0,0.0,0.0,,,,,,,,,,5,Firearms,5.0,Unknown Gun Type,,,,,,,,,,,,,The type of gun used in this incident was not reported.,1.0,0.0,0.0,0.0,0.0,0.0,0,,,,,0.0,,,,,,,,,,,,,,,,,"“Suspected Taliban’ Kill Italian Tourist in Southern Afghanistan,” Hong Kong AFP, April 13, 2003.",,,CETIS,0,1,1,1,
2943,25862,200305020008,2003,5,2,,0,,4,Afghanistan,6,South Asia,Helmand,Kajaki,32.322649,65.118402,1.0,0,,"05/2/2003: Taliban rebels launched three rockets on the Kajakai dam, Afghanistan. The dam provides electricity for Helmand and the neighboring province of Kandahar. No damage was done to the dam and there were no casualties because the rockets missed the target.",1,1,1,0,,,0,1,0,3,Bombing/Explosion,,,,,21,Utilities,107.0,Electricity,Afghanistan Energy Infrastructure,The Kajakai dam in Afghanistan,4.0,Afghanistan,,,,,,,,,,,,,,,,,Taliban,,,,,,Unknown,0.0,,,,60.0,0.0,,,,,,,,,,6,Explosives/Bombs/Dynamite,11.0,"Projectile (rockets, mortars, RPGs, etc.)",,,,,,,,,,,,,Unspecified rockets were used in this incident.,0.0,0.0,0.0,0.0,0.0,0.0,0,,,,,0.0,,,,,,,,,,,,,,,,,"""Taliban rebels arrested after failed dam attack,"" The Independent, May 03, 2003.",,,CETIS,0,0,0,0,
2945,25876,200305050008,2003,5,5,,0,,4,Afghanistan,6,South Asia,Paktia,Gardez,33.6,69.216944,1.0,1,The incident took place near Gardez.,05/05/2003: A U.S. Special Forces patrol came under rocket attack near Gardez in southeast Afghanistan. No casualties or damage resulted from the incident. The perpetrators of the incident was unknown.,1,1,0,1,1.0,Insurgency/Guerilla Action,0,1,0,3,Bombing/Explosion,,,,,4,Military,37.0,NATO,North Atlantic Treaty Organization (NATO): International Security Assistance Force (ISAF),United States Special Forces,422.0,International,,,,,,,,,,,,,,,,,Unknown,,,,,,Unknown,0.0,,,,0.0,0.0,,,,,,,,,,6,Explosives/Bombs/Dynamite,11.0,"Projectile (rockets, mortars, RPGs, etc.)",,,,,,,,,,,,,Unspecified rockets were used in this incident.,0.0,0.0,0.0,0.0,0.0,0.0,0,,,,,0.0,,,,,,,,,,,,,,,,,"""Rockets fired at US forces in Afghanistan,"" Agence France Presse, May 05, 2003.",,,CETIS,-9,-9,1,1,
2947,25891,200305070007,2003,5,7,,0,,4,Afghanistan,6,South Asia,Ghor,Qalacha,34.488889,66.117222,1.0,0,,"05/7/2003: A Muslim cleric close to U.S.-backed President Hamid Karzai was gunned down in Kalacha, Afghanistan. There were no claim of responsibility for the incident.",1,1,1,0,,,0,1,0,1,Assassination,,,,,15,Religious Figures/Institutions,85.0,Religious Figure,Muslim Cleric,"Habibullah, a Muslim cleric with ties to US-backed President Hamid Karzai, in Kalacha, Afghanistan",4.0,Afghanistan,,,,,,,,,,,,,,,,,Unknown,,,,,,Unknown,0.0,,,,0.0,0.0,,,,,,,,,,5,Firearms,5.0,Unknown Gun Type,,,,,,,,,,,,,,1.0,0.0,0.0,0.0,0.0,0.0,0,,,,,0.0,,,,,,,,,,,,,,,,Hamid Karzai blamed the Taliban and Al-Qa`ida for the incident.,"""Religious leader assassinated in Afghanistan,"" Agence France Presse, May 11, 2003.","""Afghan cleric gunned down, Taliban loyalists suspected,"" Edmonton Journal, May 11, 2003.",,CETIS,-9,-9,0,-9,
2951,25899,200305090003,2003,5,9,,0,,4,Afghanistan,6,South Asia,Balkh,Lalmi,36.068056,66.888889,2.0,0,,"05/9/2003: One Afghan soldier was killed and one U.S. soldier was injured in an attack by suspected Taliban members in Lalmi, Afghanistan.",1,1,0,1,1.0,Insurgency/Guerilla Action,0,1,0,3,Bombing/Explosion,2.0,Armed Assault,,,4,Military,29.0,Military Unit/Patrol/Convoy,U.S. Military,"A coalition patrol in Lalmi, Afghanistan",217.0,United States,4.0,Military,29.0,Military Unit/Patrol/Convoy,Afghanistan Military,"A coalition patrol in Lalmi, Afghanistan",4.0,Afghanistan,,,,,,,,,Taliban,,,,,,Unknown,1.0,,,,,0.0,,,,,,,,,,6,Explosives/Bombs/Dynamite,11.0,"Projectile (rockets, mortars, RPGs, etc.)",5.0,Firearms,5.0,Unknown Gun Type,,,,,,,,,Unspecified rockets and rifles were used in this incident.,3.0,0.0,1.0,6.0,1.0,5.0,0,,,,,0.0,,,,,,,,,,,,,,,,,"""Three killed in armed clash in east Afghanistan,"" Xinhua, May 10, 2003.","""News Summary,"" The New York Times, May 11, 2003.",,CETIS,0,1,1,1,
2957,25953,200305200002,2003,5,20,,0,,4,Afghanistan,6,South Asia,Kabul,Kabul,34.533056,69.166111,1.0,0,,"05/20/2003: An unknown attacker threw a grenade in a vehicle belonging to an unspecified nongovernmental organization in the centre of Kabul, Afghanistan. The grenade landed in the vehicle but did not explode. No group took responsibility for the incident.",1,1,1,0,,,0,0,0,3,Bombing/Explosion,,,,,12,NGO,,,Non-governmental Organization,"An unspecified a nongovernmental organization in the centre of Kabul, Afghanistan",,,,,,,,,,,,,,,,,,,Unknown,,,,,,Unknown,0.0,,,1.0,,0.0,,,,,,,,,,6,Explosives/Bombs/Dynamite,7.0,Grenade,,,,,,,,,,,,,,0.0,0.0,0.0,0.0,0.0,0.0,0,,,,,0.0,,,,,,,,,,,,,,,,,"""Attempted grenade attack on NGO vehicle in Kabul,"" Agence France Presse, May 20, 2003.",,,CETIS,-9,-9,-9,-9,
2958,25968,200305230005,2003,5,23,,0,,4,Afghanistan,6,South Asia,Khost,Khost,33.336728,69.923834,1.0,1,The incident took place between Khost and Gardez.,"05/23/2003: A U.S. Special Operations Forces two-vehicle convoy came under small arms fire while traveling from Khost to Gardez, Afghanistan. No casualties resulted from the incident and no the perpetrators were unknown.",1,1,0,1,1.0,Insurgency/Guerilla Action,0,0,0,2,Armed Assault,,,,,4,Military,37.0,NATO,North Atlantic Treaty Organization (NATO): International Security Assistance Force (ISAF),United States convoy,422.0,International,,,,,,,,,,,,,,,,,Unknown,,,,,,Unknown,0.0,,,,0.0,0.0,,,,,,,,,,5,Firearms,5.0,Unknown Gun Type,,,,,,,,,,,,,,0.0,0.0,0.0,0.0,0.0,0.0,0,,,,,0.0,,,,,,,,,,,,,,,,,"""US forces attacked in southeast Afghanistan,"" Agence France Presse, May 24, 2003.",,,CETIS,-9,-9,1,1,
2960,25973,200305240005,2003,5,24,,0,,4,Afghanistan,6,South Asia,Nangarhar,Jalalabad,34.434166999999995,70.447778,1.0,0,,"05/24/2003: An unknown perpetrator threw a grenade at an office of a French non-governmental organization, Madera, in the eastern Afghan city of Jalalabad. The incident caused no casualties. No group took responsibility for the attack.",1,1,1,0,,,0,1,0,3,Bombing/Explosion,,,,,12,NGO,62.0,International NGO,Madera,"An office of the French non-governmental organization, Madera, in the eastern Afghan city of Jalalabad",69.0,France,,,,,,,,,,,,,,,,,Unknown,,,,,,Unknown,0.0,,,1.0,0.0,0.0,,,,,,,,,,6,Explosives/Bombs/Dynamite,7.0,Grenade,,,,,,,,,,,,,,0.0,0.0,0.0,0.0,0.0,0.0,1,3.0,Minor (likely < $1 million),,Several windows were shattered in the incident.,0.0,,,,,,,,,,,,,,,,,"""Grenade attack on French NGO in Afghanistan,"" Agence France Presse, May 25, 2003.",,,CETIS,-9,-9,1,1,
2967,26006,200306010001,2003,6,1,,0,,4,Afghanistan,6,South Asia,Kandahar,Kandahar,31.617667,65.675942,1.0,0,,"06/01/2003: Unknown attackers fired two Russian-made rockets at the house of Ahmad Wali Karzai in Kandahar, Afghanistan. Ahmad Wali Karzai was a tribal leader and the brother of then Afghan President, Hamid Karzai. The rockets missed Karzai’s house and hit a nearby compound. No one was hurt in the attack, and the structure sustained only minor damage. Although local authorities suspected the Taliban and Al-Qa`ida were responsible for the attack, no group claimed responsibility for the incident.",1,1,1,0,,,0,0,0,3,Bombing/Explosion,1.0,Assassination,,,14,Private Citizens & Property,76.0,House/Apartment/Residence,Tribal Leader,"Ahmad Wali Karzai, tribal leader and brother of Afghan President Hamid Karzai",4.0,Afghanistan,,,,,,,,,,,,,,,,,Taliban,,,,,,Unknown,1.0,,,,0.0,0.0,,,,,,,,,,6,Explosives/Bombs/Dynamite,11.0,"Projectile (rockets, mortars, RPGs, etc.)",,,,,,,,,,,,,Two Russian-made rockets were fired in the attack.,0.0,0.0,0.0,0.0,0.0,0.0,1,3.0,Minor (likely < $1 million),,Rockets failed to explode and just damaged dozens of bricks along the bottom of the compound wall.,0.0,,,,,,,,,,,,,,,,"It was not known who carried out the attack but similar rocket attacks had been blamed on Taliban remnants and Al-Qa`ida. Authorities first thought that the rockets had been fired from the northwest of the city, but security guards at nearby non-governmental organizations said the damage indicated they had been fired from very close range.","“Rockets fired at brother of Afghan president,” Agence France Presse, June 2, 2003.",,,CETIS,0,0,0,0,
2968,26009,200306020001,2003,6,2,,0,,4,Afghanistan,6,South Asia,Wardak,Sheikhabad,34.082771,68.761701,1.0,1,This incident occurred along the main Kabul-Kandahar road near the village of Sheykhabad.,"06/02/2003: Unknown perpetrators fired a rocket at a camp near Sheykhabad village, Afghanistan, which was housing personnel involved in de-mining operations along the Kabul-Kandahar road. One worker was killed and eight others were injured in the attack. No group claimed responsibility, although local authorities suspected that members of the Taliban and Al-Qa`ida were behind the attack.",1,1,1,0,,,0,1,0,3,Bombing/Explosion,,,,,1,Business,5.0,Industrial/Textiles/Factory,Civilians,A camp housing workers who were de-mining the Kabul-Kandahar road.,4.0,Afghanistan,,,,,,,,,,,,,,,,,Taliban,,,,,,Unknown,1.0,,,,0.0,0.0,,,,,,,,,,6,Explosives/Bombs/Dynamite,11.0,"Projectile (rockets, mortars, RPGs, etc.)",,,,,,,,,,,,,One rocket was fired in the attack.,1.0,0.0,0.0,8.0,0.0,0.0,-9,,,,,0.0,,,,,,,,,,,,,,,,,"“Rocket attack against Afghan deminers,” Agence France Presse, June 5, 2003.",,,CETIS,0,0,0,0,
