2898,25622,200303100004,2003,3,10,,0,,45,Colombia,3,South America,La Guajira,Villanueva,10.60485,-72.97948000000002,1.0,0,,"03/10/2003: Bombs damaged a natural gas pipeline, which ran from Chuchupa to Barrancabermeja, in Villanueva, Colombia. Police blamed the Fuerzas Armadas Revolucionarias de Colombia (FARC) and the National Liberation Army (NLA) for the attack.",1,1,1,0,,,0,1,0,3,Bombing/Explosion,,,,,21,Utilities,106.0,Gas,Colombian Natural Gas Pipeline,"Natural gas pipeline linking Chuchupa to Barrancabermeja in Villanueva, Colombia",45.0,Colombia,,,,,,,,,,,,,,,,,Revolutionary Armed Forces of Colombia (FARC),,National Liberation Army of Colombia (ELN),,,,Unknown,1.0,1.0,,,0.0,0.0,,,0.0,,,,,,,6,Explosives/Bombs/Dynamite,16.0,Unknown Explosive Type,,,,,,,,,,,,,,0.0,0.0,0.0,0.0,0.0,0.0,1,3.0,Minor (likely < $1 million),,The pipeline was damaged.,0.0,,,,,,,,,,,,,,,,,"""Highlights: Colombia Guerilla/Paramilitary Activities 11-12 March 03,” Colombia Guerilla/Paramilitary Highlights, March 12, 2003.","“Guerrillas Attack Buses, Gas Pipeline in Colombia,” Xinhua News Agency, March 12, 2003.",,CETIS,0,0,0,0,
2899,25628,200303110004,2003,3,11,,0,,45,Colombia,3,South America,Arauca,Arauca district,7.08582,-70.75779,3.0,0,This incident occurred This incident occurred on a road outside of Arauca,"03/11/2003: A truck bomb exploded next to a refreshment stand on a rural road outside of Arauca, Colombia, killing one person and injuring six. Authorities suspected that the Fuerzas Armadas Revolucionarias de Colombia (FARC) and the National Liberation Army (NLA) were responsible.",1,1,1,0,,,0,1,0,3,Bombing/Explosion,,,,,1,Business,,,Civilians,"Civilians This incident occurred on a road outside of Arauca, Colombia",45.0,Colombia,,,,,,,,,,,,,,,,,Revolutionary Armed Forces of Colombia (FARC),,National Liberation Army of Colombia (ELN),,,,Unknown,1.0,1.0,,,0.0,0.0,,,0.0,,,,,,,6,Explosives/Bombs/Dynamite,16.0,Unknown Explosive Type,,,,,,,,,,,,,"A parked truck, carrying a 660-pound bomb, exploded.",1.0,0.0,0.0,6.0,0.0,0.0,-9,,,,,0.0,,,,,,,,,,,,,,,,,"Susannah Nesmith, “Bomb Kills One in Northeastern Colombia,” Associated Press, March 11, 2003.","""Highlights: Colombia Guerilla/Paramilitary Activities 11-12 Mar 03,” Colombia Guerilla/Paramilitary Highlights, March 12, 2003.",,CETIS,0,0,0,0,
2901,25631,200303110007,2003,3,11,,0,,45,Colombia,3,South America,Bogota,Bogota,4.597909,-74.076086,1.0,0,,"03/11/2003: Authorities blamed Fuerzas Armadas Revolucionarias de Colombia (FARC) rebels for simultaneous attacks on Colombian public buses in Bogota, Colombia. Rebels tossed incendiary devices into the buses, but no one was injured. It is unclear how many bombs were detonated and how many buses were targeted; sources claim between two and four. Two women were arrested after passengers identified them as the assailants who had thrown bottles of gasoline onto one of the buses.",1,1,1,0,,,0,1,0,7,Facility/Infrastructure Attack,2.0,Armed Assault,,,19,Transportation,99.0,Bus (excluding tourists),Transmilenio,"Transmilenio buses in Bogota, Colombia",45.0,Colombia,,,,,,,,,,,,,,,,,Revolutionary Armed Forces of Colombia (FARC),,,,,,Unknown,1.0,,,,2.0,0.0,,,,,,,,,,8,Incendiary,20.0,Gasoline or Alcohol,,,,,,,,,,,,,,0.0,0.0,0.0,0.0,0.0,0.0,-9,,,,It was unclear whether the incendiary devices damaged any of the buses.,0.0,,,,,,,,,,,,,,,,"Xinhua News Agency reported that four buses were attacked; one was burnt and the devices on the other three were detonated. Milwaukee Journal Sentinel reported that three buses were attacked, incinerating one. Colombia Press Highlights reported that two buses were attacked and destroyed.","""Guerillas Attack Buses, Gas Pipeline in Colombia,” Xinhua News Agency, March 12, 2003.","“Gasoline Bombs Thrown into Buses in Colombia,” Milwaukee Journal Sentinel, March 12, 2003.","“Highlights: Colombia Press 12 Mar 03,” Colombia Press Highlights, March 12, 2003.",CETIS,0,0,0,0,
2909,25666,200303160004,2003,3,16,,0,,45,Colombia,3,South America,Huila,Hobo district,2.584114,-75.45186600000002,3.0,0,This attack occurred in the mountains near Hobo.,"03/16/2003: Fuerzas Armadas Revolucionarias de Colombia (FARC) rebels blew up an electricity transmission tower near Hobo, Colombia, blacking out at least fifteen municipalities.",1,1,1,0,,,0,1,0,3,Bombing/Explosion,,,,,21,Utilities,107.0,Electricity,Electrificadora del Huila Power Company,"Electricity Transmission tower near Hobo, Colombia",45.0,Colombia,,,,,,,,,,,,,,,,,Revolutionary Armed Forces of Colombia (FARC),,,,,,Unknown,0.0,,,,0.0,0.0,,,,,,,,,,6,Explosives/Bombs/Dynamite,16.0,Unknown Explosive Type,,,,,,,,,,,,,,0.0,0.0,0.0,0.0,0.0,0.0,1,3.0,Minor (likely < $1 million),,An electricity tower was damaged.,0.0,,,,,,,,,,,,,,,,,"“Rebels Attack Colombia Electricity Supply,” Xinhua News Agency, March 18, 2003.","“Highlights: Colombia Guerilla/Paramilitary Activities 15-18 Mar 03,” Colombia Guerilla/Paramilitary Highlights, March 18, 2003.","“FARC Attack Causes Blackouts Throughout Southern Colombia,” EFE, March 17, 2003.",CETIS,0,0,0,0,
2910,25675,200303180003,2003,3,18,,0,,45,Colombia,3,South America,Arauca,Arauca,7.08582,-70.75779,1.0,0,,"03/18/2003: Colombian journalist Luis Eduardo Alfonso Parada was shot and killed by unknown assailants outside of his office in Arauca, Colombia. Parada was the second reporter with Radio Meridiano-70 to be killed within a year; the director of the station, Efrain Varela, was killed in June after reporting on the arrival of outlawed paramilitaries in Bogota. Parada had previously left Arauco after receiving death threats.",1,1,1,0,,,0,1,0,2,Armed Assault,,,,,10,Journalists & Media,53.0,Newspaper Journalist/Staff/Facility,Journalists,Luis Eduardo Alfonso Parada,45.0,Colombia,,,,,,,,,,,,,,,,,Other,,,,,,Unknown,1.0,,,,0.0,0.0,,,,,,,,,,5,Firearms,5.0,Unknown Gun Type,,,,,,,,,,,,,,1.0,0.0,0.0,0.0,0.0,0.0,0,,,,,0.0,,,,,,,,,,,,,,,,Many journalists in Arauca have been threatened by both leftist rebels and their right-wing paramilitary counterparts.,"Javier Baena, “Gunmen Kill Colombian Reporter in Arauca,” Associated Press, March 18, 2003.","“El Tiempo Journalist Gunned Down in Arauca,” Bogota El Tiempo, March 18, 2003.",,CETIS,-9,-9,0,-9,
2912,25677,200303180005,2003,3,18,,0,,45,Colombia,3,South America,Sucre,Ovejas district,9.52358,-75.23069,3.0,0,This attack occurred This incident occurred on a road between Sucre and El Carmen de Bolivar.,"03/18/2003: Suspected Fuerzas Armadas Revolucionarias de Colombia (FARC) rebels blew up tollbooths between Sucre and El Carmen de Bolivar, Colombia, destroying the booths, which were being rebuilt from previous attacks. No one was injured.",1,1,1,0,,,0,1,0,3,Bombing/Explosion,,,,,2,Government (General),21.0,Government Building/Facility/Office,Colombian Tollbooths,"Tollbooths between Sucre and El Carmen de Bolivar, Colombia",45.0,Colombia,,,,,,,,,,,,,,,,,Revolutionary Armed Forces of Colombia (FARC),,,,,,Unknown,0.0,,,,0.0,0.0,,,,,,,,,,6,Explosives/Bombs/Dynamite,16.0,Unknown Explosive Type,,,,,,,,,,,,,A medium-intensity explosive device was used.,0.0,0.0,0.0,0.0,0.0,0.0,1,3.0,Minor (likely < $1 million),,The number of tollbooths destroyed is unknown.,0.0,,,,,,,,,,,,,,,,,"“Highlights: Colombia Guerilla/Paramilitary Activities 20-21 Mar 03,” Colombia Guerilla/Paramilitary Highlights, March 21, 2003.","“Highlights: Colombia Regional Press 20 Mar 03,” Colombia Regional Press Highlights, March 20, 2003.",,CETIS,0,0,0,0,
2915,25691,200303210003,2003,3,21,,0,,45,Colombia,3,South America,Narino,Ricaurte,1.210589,-77.99332700000002,1.0,0,,"03/21/2003: Rebels from the Fuerzas Armadas Revolucionarias de Colombia (FARC) and the National Liberation Army (NLA) attacked the main square in Ricaurte, Colombia by firing explosive-filled gas cylinders and causing fires. A policeman and one civilian were injured. The city hall and police headquarters were destroyed, while nearby homes were damaged.",1,1,1,0,,,0,1,0,2,Armed Assault,,,,,2,Government (General),21.0,Government Building/Facility/Office,Colombian City Hall,"City Hall in Ricaurte, Colombia",45.0,Colombia,3.0,Police,22.0,"Police Building (headquarters, station, school)",Colombian Police,"Police Headquarters in Ricaurte, Colombia",45.0,Colombia,14.0,Private Citizens & Property,67.0,Unnamed Civilian/Unspecified,Civilians,"Civilians in Ricaurte, Colombia",45.0,Colombia,Revolutionary Armed Forces of Colombia (FARC),,National Liberation Army of Colombia (ELN),,,,Unknown,0.0,0.0,,,,0.0,,,0.0,,,,,,,8,Incendiary,20.0,Gasoline or Alcohol,,,,,,,,,,,,,The rebels used explosive-filled gas cylinders in the attack.,0.0,0.0,0.0,2.0,0.0,0.0,1,4.0,Unknown,,"Explosions and fires destroyed the city hall, police headquarters, and damaged nearby homes.",0.0,,,,,,,,,,,,,,,,,"“Highlights: Colombia Guerilla/Paramilitary Activities 20-21 Mar 03,” Colombia Guerilla/Paramilitary Highlights, March 21, 2003.",,,CETIS,0,0,0,0,
2919,25722,200303250002,2003,3,25,,0,,45,Colombia,3,South America,Narino,Ipiales,0.823757,-77.634908,1.0,0,,"03/25/2003: Suspected Fuerzas Armadas Revolucionarias de Colombia (FARC) rebels toppled a communication tower in Ipiales, Colombia, cutting telephone service to 60 percent of Putumayo Department.",1,1,1,0,,,0,1,0,7,Facility/Infrastructure Attack,,,,,16,Telecommunication,90.0,Telephone/Telegraph,Colombian Telecommunication System,"Communication tower in Ipiales, Colombia",45.0,Colombia,,,,,,,,,,,,,,,,,Revolutionary Armed Forces of Colombia (FARC),,,,,,Unknown,1.0,,,,0.0,0.0,,,,,,,,,,13,Unknown,,,,,,,,,,,,,,,,0.0,0.0,0.0,0.0,0.0,0.0,1,3.0,Minor (likely < $1 million),,The extent of damage done to the communication tower is indeterminable.,0.0,,,,,,,,,,,,,,,,,"“Highlights: Colombia Guerilla/Paramilitary Activities 25-26 Mar 03,” Colombia Guerilla/Paramilitary Highlights, March 26, 2003.",,,CETIS,0,0,0,0,
2923,25730,200303260005,2003,3,26,,0,,45,Colombia,3,South America,Cauca,Timba,3.113889,-76.626111,1.0,0,,03/26/2003: The Colombian Army defused four charges placed on an electricity pylon in Timba. The thwarted attack by Fuerzas Armadas Revolucionarias de Colombia (FARC) guerillas was on a key point in the power grid.,1,1,1,0,,,0,0,0,3,Bombing/Explosion,,,,,21,Utilities,107.0,Electricity,Colombian Electricity System,Electricity pylon carrying power from the Salvajina dam to the Pance substation in Timba,45.0,Colombia,,,,,,,,,,,,,,,,,Revolutionary Armed Forces of Colombia (FARC),,,,,,Unknown,0.0,,,,0.0,0.0,,,,,,,,,,6,Explosives/Bombs/Dynamite,16.0,Unknown Explosive Type,,,,,,,,,,,,,"The devices were composed of eight kg of ammonal and ammonium nitrate fuel oil, ANFO.",0.0,0.0,0.0,0.0,0.0,0.0,0,,,,,0.0,,,,,,,,,,,,,,,,,"“Highlights: Colombia Guerilla/Paramilitary Activities 26-27 Mar 03,” Colombia Guerilla/Paramilitary Highlights, March 27, 2003.",,,CETIS,0,0,0,0,
2925,25732,200303260007,2003,3,26,,1,,45,Colombia,3,South America,Bolivar,Achi district,8.568451,-74.55436,3.0,0,Event occurred along the Covao Creek,"03/26/2003: People's Revolutionary Army (ERP) rebels killed a passenger boat captain, wounded two passengers and took three others hostage at an illegal checkpoint on the Covao Creek near Achi, Colombia. The boat was carrying 18 passengers from Guaranda to Magangue.",1,1,1,0,,,0,1,0,2,Armed Assault,6.0,Hostage Taking (Kidnapping),,,14,Private Citizens & Property,67.0,Unnamed Civilian/Unspecified,Civilians,"Civilians on a boat in Covao Creek, Colombia",45.0,Colombia,,,,,,,,,,,,,,,,,People's Revolutionary Army (ERP),,,,,,Unknown,0.0,,,,0.0,-9.0,,,,,,,,,-9.0,13,Unknown,,,,,,,,,,,,,,,,1.0,0.0,0.0,2.0,0.0,0.0,0,,,,,1.0,3.0,0.0,,-99.0,,,,,,,,,7.0,Unknown,-99.0,,"“Highlights: Colombia Guerilla/Paramilitary Activities 27-28 Mar 03,” Colombia Guerilla/Paramilitary Highlights, March 28, 2003.",,,CETIS,0,0,0,0,
2926,25739,200303270004,2003,3,27,,1,,45,Colombia,3,South America,Antioquia,Medellin district,6.270526,-75.57217299999998,3.0,0,This attack occurred This incident occurred on a road to Medellin.,"03/27/2003: National Liberation Army (NLA) guerillas kidnapped a police officer at a roadblock to Medellin, Colombia. The officer was accompanying the mayor of Yolombo, who was released soon after a brief detention, but the outcome of the police officer was unknown.",1,1,1,0,,,0,1,0,6,Hostage Taking (Kidnapping),,,,,3,Police,25.0,Police Security Forces/Officers,Colombian Police,"Police officer accompanying mayor of Yolombo, Colombia",45.0,Colombia,,,,,,,,,,,,,,,,,National Liberation Army of Colombia (ELN),,,,,,Unknown,0.0,,,,,-9.0,,,,,,,,,-9.0,13,Unknown,,,,,,,,,,,,,,,,0.0,0.0,0.0,0.0,0.0,0.0,0,,,,,1.0,1.0,0.0,,-99.0,,,,,,,,,7.0,Unknown,-99.0,,"“Highlights: Colombia Guerilla/Paramilitary Activities 26-27 Mar 03,” Colombia Guerilla/Paramilitary Highlights, March 27, 2003.",,,CETIS,0,0,0,0,
2927,25740,200303270005,2003,3,27,,0,,45,Colombia,3,South America,Caqueta,Doncello,1.68448,-75.28659,1.0,0,,"03/27/2003: Fuerzas Armadas Revolucionarias de Colombia (FARC) rebels detonated a bomb at an electricity substation in El Doncello, Colombia, damaging equipment and the power grid.",1,1,1,0,,,0,1,0,3,Bombing/Explosion,,,,,21,Utilities,107.0,Electricity,Colombian Electricity System,"Electricity substation in El Doncello, Colombia",45.0,Colombia,,,,,,,,,,,,,,,,,Revolutionary Armed Forces of Colombia (FARC),,,,,,Unknown,0.0,,,,0.0,0.0,,,,,,,,,,6,Explosives/Bombs/Dynamite,16.0,Unknown Explosive Type,,,,,,,,,,,,,The rebels detonated 50 kg of explosives.,0.0,0.0,0.0,0.0,0.0,0.0,1,3.0,Minor (likely < $1 million),,The explosion damaged equipment in the substation.,0.0,,,,,,,,,,,,,,,,,"“Highlights: Colombia Guerilla/Paramilitary Activities 26-27 Mar 03,” Colombia Guerilla/Paramilitary Highlights, March 27, 2003.",,,CETIS,0,0,0,0,
2936,25818,200304170005,2003,4,19,,0,,45,Colombia,3,South America,Bolivar,Unknown,8.670438,-74.030012,4.0,0,,"4/19/2003: Suspected members of Revolutionary Armed Forces of Colombia (FARC) threw a bomb hidden inside a soccer ball outside of a private residence in Bolivar Department, Colombia.  Four family members were injured in the explosion.  Specific motive is unknown; however, the bomb was thrown into an area where police often pass.  No police officers were injured in the ensuing blast.",1,1,1,0,,,0,1,0,3,Bombing/Explosion,,,,,14,Private Citizens & Property,67.0,Unnamed Civilian/Unspecified,Civilians,A family living in Bolivar Department,45.0,Colombia,3.0,Police,25.0,Police Security Forces/Officers,Police,Colombian police passing through the area,45.0,Colombia,,,,,,,,,Revolutionary Armed Forces of Colombia (FARC),,,,,,Specific motive is unknown; however; the area was often traveled by police,1.0,,,-99.0,0.0,0.0,,,,,,,,,,6,Explosives/Bombs/Dynamite,12.0,Remote Trigger,,,,,,,,,,,,,A remote-controlled bomb hidden inside a soccer ball,0.0,0.0,0.0,4.0,0.0,0.0,-9,,,,,0.0,,,,,,,,,,,,,,,,,"""Colombian Rebels Kill Soldier and Detonate Bomb, Injuring Four Civilians,"" Associated Press, April 17, 2003",,,UMD Schmid 2012,0,0,0,0,
2937,25819,200304170006,2003,4,17,,0,,45,Colombia,3,South America,Arauca,Fortul,6.792231,-71.775544,1.0,0,,"4/17/2003: A bomb exploded near a military checkpoint in the town of Fortul, Arauca Department, Colombia.  The bicycle was being ridden by a 10-year old boy at the time that it exploded; he had been tricked by rebels into riding the bike towards the checkpoint.  The boy died in the explosion and three other civilians were injured.  No group claimed responsibility for the incident.",1,1,1,0,,,0,1,0,3,Bombing/Explosion,,,,,4,Military,36.0,Military Checkpoint,Colombian military,A military checkpoint in the vicinity of Fortul town,45.0,Colombia,14.0,Private Citizens & Property,67.0,Unnamed Civilian/Unspecified,Civilians,A 10-year-old boy and other civilians in the vicinity of the checkpoint,45.0,Colombia,,,,,,,,,Rebels,,,,,,"Specific motive is unknown; however, the boy had been directed to ride towards the military checkpoint.  Rebels have been fighting for control of oil resources in the area.",0.0,,,-99.0,0.0,0.0,,,,,,,,,,6,Explosives/Bombs/Dynamite,16.0,Unknown Explosive Type,,,,,,,,,,,,,A bomb loaded onto a bicycle,1.0,0.0,0.0,3.0,0.0,0.0,-9,,,,,0.0,,,,,,,,,,,,,,,,"The bomb detonated prematurely, before the boy had the chance to reach the checkpoint","""Colombian Child Dies After Being Tricked into Riding Rebel Bike Bomb to Military Checkpoint,"" Associated Press,  April 17, 2003",,,UMD Schmid 2012,-9,-9,0,-9,
2938,25820,200304180001,2003,4,18,,0,,45,Colombia,3,South America,Tolima,Dolores,3.538611,-74.896111,1.0,0,,"04/18/2003: Rebels belonging to the Fuerzas Armadas Revolucionarias de Colombia (FARC)killed two peasants and one soldier during a Good Friday procession in Dolores, Colombia. Two people were also wounded. The rebels targeted both civilians and Colombian soldiers from the Sixth Brigade who were protecting the procession. The soldiers chased the rebels into the countryside.",1,1,1,1,1.0,Insurgency/Guerilla Action,0,1,0,2,Armed Assault,,,,,4,Military,34.0,"Military Personnel (soldiers, troops, officers, forces)",Sixth Brigade,Francisco Hernandez,45.0,Colombia,14.0,Private Citizens & Property,68.0,Named Civilian,Civilians,Didier Steven Gonzalez,45.0,Colombia,,,,,,,,,Revolutionary Armed Forces of Colombia (FARC),,,,,,Unknown,0.0,,,,,0.0,,,,,,,,,,5,Firearms,5.0,Unknown Gun Type,,,,,,,,,,,,,,3.0,0.0,0.0,2.0,0.0,0.0,0,,,,,0.0,,,,,,,,,,,,,,,,Civilian Fabio Ortiz was also killed in the attack.,"“Two Dead in Good Friday Attack in Colombia; FARC Blamed,” AFP, April 18, 2003.","“FARC Attack Town as Residents Observe Good Friday; 3 Dead,” Caracol Colombia Radio, April 19, 2003.",,CETIS,0,0,0,0,
2939,25826,200304190002,2003,4,19,,1,,45,Colombia,3,South America,Sucre,Isla Mucura,9.781757,-75.872394,1.0,0,300 miles northwest of Bogota,"4/19/2003: Approximately 20 gunmen attacked Mucura Island, Colombia.  The assailants used speedboats to gain access to the island, where they kidnapped eight vacationers, including an eight-year-old boy and bodyguards of businessmen.  No group has claimed responsibility and the motive is unknown.",0,1,1,1,2.0,Other Crime Type,0,1,0,6,Hostage Taking (Kidnapping),,,,,14,Private Citizens & Property,67.0,Unnamed Civilian/Unspecified,Civilians,Civilians vacationing on Mucura Island,45.0,Colombia,,,,,,,,,,,,,,,,,Gunmen,,,,,,Unknown,0.0,,,20.0,0.0,0.0,,,,,,,,,,5,Firearms,5.0,Unknown Gun Type,,,,,,,,,,,,,,0.0,0.0,0.0,0.0,0.0,0.0,0,,,,,1.0,8.0,-99.0,-99.0,-99.0,,,-9.0,,,,,,7.0,Unknown,-99.0,This may have been a purely profit-motivated kidnapping.,"""Politics May Stall Mideast Peace Plan,"" Times Wires, April 21, 2003","""World Today,"" Belfast News Letter, April 22,2003",,UMD Schmid 2012,-9,-9,0,-9,
2940,25829,200304210001,2003,4,21,,1,2003-04-26,45,Colombia,3,South America,Antioquia,Cocorna,6.05703,-75.18513,1.0,1,,"4/21/2003: Suspected members of National Liberation Army of Colombia (ELN) abducted a school teacher, Ana Cecilia Duque, as she was walking to school in the vicinity of Cocorna town, Antioquia Department, Colombia.  The rebels left a note with another teacher that had been walking with Duque.  The note was for Duque's father, Gabriel Villages; it accused him of collaborating with right-wing paramilitary forces.  It stated that he had two days to assassinate the paramilitary warlord Matute in return for the safe return of his daughter.  Duque's father refused to comply.  Ana Cecilia Duque was found on April 26, 2003; she had been shot in the back of the head.",1,1,1,0,,,0,1,0,6,Hostage Taking (Kidnapping),2.0,Armed Assault,,,8,Educational Institution,48.0,Teacher/Professor/Instructor,Civilian,"Ana Cecilia Duque, a schoolteacher",45.0,Colombia,4.0,Military,39.0,Paramilitary,Paramilitary,"Matute, an alleged paramilitary warlord",45.0,Colombia,,,,,,,,,National Liberation Army of Colombia (ELN),,,,,,The assailants left a note for the victim's father demanding that he kill a paramilitary warlord in return for the safe return of his daughter.,1.0,,,-99.0,0.0,0.0,,,,,,,,,,5,Firearms,5.0,Unknown Gun Type,,,,,,,,,,,,,The victim was shot in the back of the head and her body was left by the side of the road,1.0,0.0,0.0,0.0,0.0,0.0,0,,,,,1.0,1.0,0.0,0.0,5.0,,,0.0,,,,,The assailants demanded that a rival paramilitary leader be killed,4.0,Hostage(s) killed (not during rescue attempt),0.0,"It is unknown whether Duque's father, Gabriel Villages, actually knew Matute","""Colombian Rebels Murder Teacher in 'Act of Madness',"" The Independent, April 28, 2003","""Colombian School Teacher Found Dead After Kidnapping by Presumed Rebels,"" Associated Press, April 26, 2003",,UMD Schmid 2012,0,0,0,0,
2942,25855,200305020001,2003,5,2,,0,,45,Colombia,3,South America,Antioquia,Medellin,6.270526,-75.57217299999998,1.0,0,,"05/2/2003: A parcel-bomb went off in a shopping center, injuring at least seven civilians in Medellin, Colombia. The perpetrators were unknown.",1,1,1,0,,,0,1,0,3,Bombing/Explosion,,,,,1,Business,7.0,Retail/Grocery/Bakery,,"A shopping center in Medellin, Colombia",45.0,Colombia,,,,,,,,,,,,,,,,,Unknown,,,,,,Unknown,0.0,,,,0.0,0.0,,,,,,,,,,6,Explosives/Bombs/Dynamite,9.0,Letter Bomb,,,,,,,,,,,,,A parcel-bomb was used in this incident.,0.0,0.0,0.0,7.0,0.0,0.0,1,3.0,Minor (likely < $1 million),,The incident broke windows in buildings.,0.0,,,,,,,,,,,,,,,,,"""At least seven injured in Mall bomb blast in Colombia,"" EFE, May 02, 2003.",,,CETIS,-9,-9,0,-9,
2944,25864,200305030002,2003,5,3,,0,,45,Colombia,3,South America,Risaralda,Quinchia,5.337522,-75.729304,1.0,0,,"05/3/2003: Alleged members of the Popular Liberation Army (EPL) attacked police officers in an ambush in the rural area of Quinchia, Colombia. Three officers were killed and four wounded in the incident.",1,1,1,0,,,0,1,0,9,Unknown,,,,,3,Police,23.0,Police Patrol (including vehicles and convoys),Colombian Police,"A police patrol in Quinchia, Colombia",45.0,Colombia,,,,,,,,,,,,,,,,,Popular Liberation Army (EPL),,,,,,Unknown,1.0,,,,0.0,0.0,,,,,,,,,,13,Unknown,,,,,,,,,,,,,,,,3.0,0.0,0.0,4.0,0.0,0.0,0,,,,,0.0,,,,,,,,,,,,,,,,,"""Three policemen killed in rebel ambush in Colombia,"" EFE, May 04, 2003.",,,CETIS,0,0,0,0,
2946,25878,200305050010,2002,4,21,,1,2003-05-05,45,Colombia,3,South America,Antioquia,Unknown,7.198606,-75.34121800000001,4.0,0,,"4/21/2002: Members of Revolutionary Armed Forces of Colombia (FARC) kidnapped several high profile figures during a peace march in Antioquia Department, Colombia.  Those kidnapped included Guillermo Gaviria, the provincial governor; Gilberto Echeverri, a former defence minister; and Carlos Yepes, a chaplain.  Four other prominent people were also kidnapped but were released shortly after.  On May 5, 2003, Gaviria and Echeverri were killed, along with eight captive soldiers, during an army-led rescue attempt.",1,1,1,0,,,0,1,0,6,Hostage Taking (Kidnapping),,,,,2,Government (General),18.0,"Government Personnel (excluding police, military)",Provincial governor,Antioquia Governor Guillermo Gaviria and former national defense minister Gilberto Echeverri,45.0,Colombia,15.0,Religious Figures/Institutions,85.0,Religious Figure,Chaplain,"Carlos Yepes, a government chaplain",45.0,Colombia,,,,,,,,,Revolutionary Armed Forces of Colombia (FARC),,,,,,Unknown,0.0,,,-99.0,0.0,-9.0,,,,,,,,,0.0,5,Firearms,5.0,Unknown Gun Type,,,,,,,,,,,,,,10.0,0.0,0.0,,0.0,0.0,0,,,,,1.0,3.0,0.0,0.0,379.0,,,-9.0,,,,,,1.0,Attempted Rescue,,It is unclear whether the chaplain was released or killed at a different time,"""Colombia Reeling After 10 Hostages Killed In Botched Rescue,"" Agence France Presse, May 6, 2003","""Family Members of Hostages Killed in Rescue Attempt Blame the Government, "" Associated Press, May 6, 2003","""FARC kidnaps governor,"" The Guardian, April 23, 2002.",UMD Schmid 2012,0,0,0,0,
2950,25896,200305080005,2003,5,8,,0,,45,Colombia,3,South America,Caldas,Pensilvania,5.384329,-75.161146,1.0,0,,"05/8/2003: Unknown perpetrators blew up a communications tower in the western city of Pensilvania, Colombia. The government simply reported that an unspecified terrorist group was responsible for the incident.",1,1,1,0,,,0,1,0,3,Bombing/Explosion,,,,,16,Telecommunication,,,Colombian Communication Infrastructure,"A communications tower in the western city of Pensilvania, Colombia",45.0,Colombia,,,,,,,,,,,,,,,,,Unknown,,,,,,Unknown,0.0,,,,0.0,0.0,,,,,,,,,,6,Explosives/Bombs/Dynamite,28.0,Dynamite/TNT,,,,,,,,,,,,,,0.0,0.0,0.0,0.0,0.0,0.0,1,3.0,Minor (likely < $1 million),,A communications tower was damaged in the incident.,0.0,,,,,,,,,,,,,,,,FARC destroyed down hundreds of electricity pylons and dynamited numerous bridges in the same region the previous year after the breakdown of peace negotiations with the government.,"""Four dead, power out across southwestern Colombia as rebels go on offensive,"" Agence France Presse, May 09, 2003.",,,CETIS,-9,-9,0,-9,
2952,25901,200305090005,2003,5,9,,0,,45,Colombia,3,South America,Valle del Cauca,Cali,3.420636,-76.522251,1.0,0,,"05/9/2003: Three security officials were killed in a bomb attack on a water treatment facility in Santiago de Cali, Colombia. The blast did not interrupt the delivery of drinking water. No group claimed responsibility for the attack.",1,1,1,0,,,0,1,0,3,Bombing/Explosion,,,,,9,Food or Water Supply,52.0,Water Supply,Colombian Water Supply Infrastructure,"A water treatment facility in Santiago de Cali, Colombia",45.0,Colombia,,,,,,,,,,,,,,,,,Unknown,,,,,,Unknown,0.0,,,,0.0,0.0,,,,,,,,,,6,Explosives/Bombs/Dynamite,16.0,Unknown Explosive Type,,,,,,,,,,,,,,3.0,0.0,0.0,0.0,0.0,0.0,1,4.0,Unknown,,,0.0,,,,,,,,,,,,,,,,"The authorities did not report who was thought to be responsible for the attacks; however, they noted that FARC guerillas had recently been on the offensive in the region.","""Four dead, power out across southwestern Colombia as rebels go on offensive,"" Agence France Presse, May 09, 2003.",,,CETIS,-9,-9,0,-9,
