2541,23248,200108230002,2001,8,23,,0,,45,Colombia,3,South America,Antioquia,Rio Negro,6.153669,-75.37416,1.0,0,,"08/23/2001: A bomb was detonated in a gambling company by suspected National Liberation Army (ELN) members in Rionegro Municipality, Colombia. No injuries were reported.",1,1,1,0,,,1,1,0,3,Bombing/Explosion,,,,,1,Business,11.0,Entertainment/Cultural/Stadium/Casino,Colombian Commercial Enterprises,"Gambling Company Office in Rionegro Municipality, Colombia",45.0,Colombia,,,,,,,,,,,,,,,,,National Liberation Army of Colombia (ELN),,,,,,Unknown,1.0,,,,0.0,0.0,,,,,,,,,,6,Explosives/Bombs/Dynamite,16.0,Unknown Explosive Type,,,,,,,,,,,,,,0.0,0.0,0.0,0.0,0.0,0.0,1,3.0,Minor (likely < $1 million),,,0.0,,,,,,,,,,,,,,,,,"“Terrorist Attacks in Medellin Area Cause 'Considerable' Damage,” El Colombiano, August 23, 2001.","“Colombian Guerrilla, Paramilitary Activities 23 August,” FBIS, August 23, 2001.",,CETIS,0,0,0,0,"200108230001, 200108230003, 200108230004, 200108230005, 200108230006, 200108230007, 200108230008, 200108230009"
2542,23249,200108230003,2001,8,23,,0,,45,Colombia,3,South America,Antioquia,Rio Negro,6.153669,-75.37416,1.0,0,,"08/23/2001: A bomb was detonated by the National Liberation Army (ELN) in a second gambling company in Rionegro Municipality, Antioquia Department, Colombia. No injuries were reported.",1,1,1,0,,,1,1,0,3,Bombing/Explosion,,,,,1,Business,11.0,Entertainment/Cultural/Stadium/Casino,Colombian Commercial Enterprises,"Gambling Company Office in Rionegro Municipality, Colombia",45.0,Colombia,,,,,,,,,,,,,,,,,National Liberation Army of Colombia (ELN),,,,,,Unknown,1.0,,,,0.0,0.0,,,,,,,,,,6,Explosives/Bombs/Dynamite,16.0,Unknown Explosive Type,,,,,,,,,,,,,,0.0,0.0,0.0,0.0,0.0,0.0,1,3.0,Minor (likely < $1 million),,,0.0,,,,,,,,,,,,,,,,,"“Terrorist Attacks in Medellin Area Cause 'Considerable' Damage,” El Colombiano, August 23, 2001.","“Colombian Guerrilla, Paramilitary Activities 23 August,” FBIS, August 23, 2001.",,CETIS,0,0,0,0,"200108230001, 200108230002, 200108230004, 200108230005, 200108230006, 200108230007, 200108230008, 200108230009"
2543,23250,200108230004,2001,8,23,,0,,45,Colombia,3,South America,Antioquia,Rio Negro,6.153669,-75.37416,1.0,0,,"08/23/2001: A bomb was detonated by suspected National Liberation Army (ELN) members in a third gambling company in Rionegro Municipality, Antioquia Department, Colombia. No injuries were reported.",1,1,1,0,,,1,1,0,3,Bombing/Explosion,,,,,1,Business,11.0,Entertainment/Cultural/Stadium/Casino,Colombian Commercial Enterprises,"Gambling Company Office in Rionegro Municipality, Colombia",45.0,Colombia,,,,,,,,,,,,,,,,,National Liberation Army of Colombia (ELN),,,,,,Unknown,1.0,,,,0.0,0.0,,,,,,,,,,6,Explosives/Bombs/Dynamite,16.0,Unknown Explosive Type,,,,,,,,,,,,,,0.0,0.0,0.0,0.0,0.0,0.0,1,3.0,Minor (likely < $1 million),,,0.0,,,,,,,,,,,,,,,,,"“Terrorist Attacks in Medellin Area Cause 'Considerable' Damage,” El Colombiano, August 23, 2001.","“Colombian Guerrilla, Paramilitary Activities 23 August,” FBIS, August 23, 2001.",,CETIS,0,0,0,0,"200108230001, 200108230002, 200108230003, 200108230005, 200108230006, 200108230007, 200108230008, 200108230009"
2544,23251,200108230005,2001,8,23,,0,,45,Colombia,3,South America,Antioquia,Medellin,6.270526,-75.57217299999998,1.0,0,,"08/23/2001: A bomb was detonated in the office of Cattlemen Bank in a suspected National Liberation Army (ELN) attack in Medellin, Antioquia Department, Colombia. No injuries were reported.",1,1,1,0,,,1,1,0,3,Bombing/Explosion,,,,,1,Business,3.0,Bank/Commerce,Cattlemen Bank,"Office of Cattlemen Bank in Medellin, Colombia",45.0,Colombia,,,,,,,,,,,,,,,,,National Liberation Army of Colombia (ELN),,,,,,Unknown,1.0,,,,0.0,0.0,,,,,,,,,,6,Explosives/Bombs/Dynamite,16.0,Unknown Explosive Type,,,,,,,,,,,,,,0.0,0.0,0.0,0.0,0.0,0.0,1,3.0,Minor (likely < $1 million),,,0.0,,,,,,,,,,,,,,,,,"“Terrorist Attacks in Medellin Area Cause 'Considerable' Damage,” El Colombiano, August 23, 2001.","“Colombian Guerrilla, Paramilitary Activities 23 August,” FBIS, August 23, 2001.",,CETIS,0,0,0,0,"200108230001, 200108230002, 200108230003, 200108230004, 200108230006, 200108230007, 200108230008, 200108230009"
2545,23252,200108230006,2001,8,23,,0,,45,Colombia,3,South America,Antioquia,Medellin,6.270526,-75.57217299999998,1.0,0,,"08/23/2001: Two bombs were detonated at Le Apuesto gambling company by suspected members of the National Liberation Army (ELN) in Medellin, Colombia. No injuries were reported.",1,1,1,0,,,1,1,0,3,Bombing/Explosion,,,,,1,Business,11.0,Entertainment/Cultural/Stadium/Casino,Le Apuesto Gambling Company,Building of Le Apuesto Gambling Company,45.0,Colombia,,,,,,,,,,,,,,,,,National Liberation Army of Colombia (ELN),,,,,,Unknown,1.0,,,,0.0,0.0,,,,,,,,,,6,Explosives/Bombs/Dynamite,16.0,Unknown Explosive Type,,,,,,,,,,,,,,0.0,0.0,0.0,0.0,0.0,0.0,1,3.0,Minor (likely < $1 million),,,0.0,,,,,,,,,,,,,,,,,"“Terrorist Attacks in Medellin Area Cause 'Considerable' Damage,” El Colombiano, August 23, 2001.","“Colombian Guerrilla, Paramilitary Activities 23 August,” FBIS, August 23, 2001.",,CETIS,0,0,0,0,"200108230001, 200108230002, 200108230003, 200108230004, 200108230005, 200108230007, 200108230008, 200108230009"
2546,23253,200108230007,2001,8,23,,0,,45,Colombia,3,South America,Antioquia,Medellin,6.270526,-75.57217299999998,1.0,0,,"08/23/2001: A bomb was detonated in an office in a suspected attack by the National Liberation Army (ELN) in Medellin, Antioquia Department, Colombia. No injuries were reported.",1,1,1,0,,,1,1,0,3,Bombing/Explosion,,,,,1,Business,,,Colombian Commercial Enterprises,Unknown Office Building,45.0,Colombia,,,,,,,,,,,,,,,,,National Liberation Army of Colombia (ELN),,,,,,Unknown,1.0,,,,0.0,0.0,,,,,,,,,,6,Explosives/Bombs/Dynamite,16.0,Unknown Explosive Type,,,,,,,,,,,,,,0.0,0.0,0.0,0.0,0.0,0.0,1,3.0,Minor (likely < $1 million),,,0.0,,,,,,,,,,,,,,,,,"“Terrorist Attacks in Medellin Area Cause 'Considerable' Damage,” El Colombiano, August 23, 2001.","“Colombian Guerrilla, Paramilitary Activities 23 August,” FBIS, August 23, 2001.",,CETIS,0,0,0,0,"200108230001, 200108230002, 200108230003, 200108230004, 200108230005, 200108230006, 200108230008, 200108230009"
2547,23254,200108230008,2001,8,23,,0,,45,Colombia,3,South America,Antioquia,Medellin,6.270526,-75.57217299999998,1.0,0,,"08/23/2001: A bomb was detonated in the office of Superior Bank in a suspect attack by the National Liberation Army (ELN) in Medellin, Antioquia Department, Colombia. No injuries were reported.",1,1,1,0,,,1,1,0,3,Bombing/Explosion,,,,,1,Business,3.0,Bank/Commerce,Superior Bank,"Office of Superior Bank in Medellin, Colombia",45.0,Colombia,,,,,,,,,,,,,,,,,National Liberation Army of Colombia (ELN),,,,,,Unknown,1.0,,,,0.0,0.0,,,,,,,,,,6,Explosives/Bombs/Dynamite,16.0,Unknown Explosive Type,,,,,,,,,,,,,,0.0,0.0,0.0,0.0,0.0,0.0,1,3.0,Minor (likely < $1 million),,,0.0,,,,,,,,,,,,,,,,,"“Terrorist Attacks in Medellin Area Cause 'Considerable' Damage,” El Colombiano, August 23, 2001.","“Colombian Guerrilla, Paramilitary Activities 23 August,” FBIS, August 23, 2001.",,CETIS,0,0,0,0,"200108230001, 200108230002, 200108230003, 200108230004, 200108230005, 200108230006, 200108230007, 200108230009"
2548,23255,200108230009,2001,8,23,,0,,45,Colombia,3,South America,Antioquia,Medellin,6.1691400000000005,-75.52405999999998,1.0,0,The incident occurred near the El Rodeo neighborhood,"08/23/2001: Explosives were detonated in a Medellin Public Enterprises electric pylon in the El Rodeo-Itagui area, Colombia in a suspected attack by the National Liberation Army (ELN). No injuries were reported.",1,1,1,0,,,1,1,0,3,Bombing/Explosion,,,,,21,Utilities,107.0,Electricity,Medellin Public Enterprises,Medellin Public Enterprises Electricity Pylon,45.0,Colombia,,,,,,,,,,,,,,,,,National Liberation Army of Colombia (ELN),,,,,,Unknown,1.0,,,,0.0,0.0,,,,,,,,,,6,Explosives/Bombs/Dynamite,16.0,Unknown Explosive Type,,,,,,,,,,,,,,0.0,0.0,0.0,0.0,0.0,0.0,1,3.0,Minor (likely < $1 million),,,0.0,,,,,,,,,,,,,,,,,"“Terrorist Attacks in Medellin Area Cause 'Considerable' Damage,” El Colombiano, August 23, 2001.","“Colombian Guerrilla, Paramilitary Activities 23 August,” FBIS, August 23, 2001.","“Bomb blasts in Colombian city attributed to ELN: police,” Agence France Presse, August 24, 2001.",CETIS,0,0,0,0,"200108230001, 200108230002, 200108230003, 200108230004, 200108230005, 200108230006, 200108230007, 200108230008"
2549,23257,200108230011,2001,8,23,,1,,45,Colombia,3,South America,Bolivar,Carmen de Bolivar district,9.71809,-75.12097,3.0,0,,"08/23/2001: Ten people were kidnapped by the United Self Defense Forces of Columbia (AUC) in Carmen de Bolivar Municipality, Bolivar Department, Colombia.",1,1,1,0,,,0,1,0,6,Hostage Taking (Kidnapping),,,,,14,Private Citizens & Property,67.0,Unnamed Civilian/Unspecified,Civilians,"Civilians in Carmen de Bolivar Municipality, Bolivar Department, Colombia",45.0,Colombia,,,,,,,,,,,,,,,,,United Self Defense Units of Colombia (AUC),,,,,,Unknown,0.0,,,,0.0,0.0,,,,,,,,,,13,Unknown,,,,,,,,,,,,,,,,0.0,0.0,0.0,0.0,0.0,0.0,0,,,,,1.0,10.0,0.0,,-99.0,,,,,,,,,7.0,Unknown,,,"“Colombian Guerrilla, Paramilitary Activities 23 August,” FBIS, August 23, 2001.",,,CETIS,0,0,0,0,
2550,23262,200108230016,2001,8,23,,0,,45,Colombia,3,South America,Antioquia,Marinilla,6.173826,-75.334737,1.0,0,,"08/23/2001: A car bomb planted by the National Liberation Army (ELN) outside a police station in Marinilla, Colombia killed one and wounded 20. The car bomb, containing an estimated 175 pounds of explosives, destroyed a police station, a girls' high school, a government office and a funeral home.",1,1,1,0,,,0,1,0,3,Bombing/Explosion,,,,,3,Police,22.0,"Police Building (headquarters, station, school)",Colombian Law Enforcement,"Police Station in Marinilla, Colombia",45.0,Colombia,,,,,,,,,,,,,,,,,National Liberation Army of Colombia (ELN),,,,,,Unknown,0.0,,,,0.0,0.0,,,,,,,,,,6,Explosives/Bombs/Dynamite,16.0,Unknown Explosive Type,,,,,,,,,,,,,,1.0,0.0,0.0,20.0,0.0,0.0,1,2.0,Major (likely > $1 million but < $1 billion),,"The bomb destroyed a police station, a girls' high school, a government office and a funeral home.",0.0,,,,,,,,,,,,,,,,,"“World Briefs,” The Houston Chronicle, August 24, 2001.","“21 dead, 25 wounded in attacks around,” Agence France Presse, August 24, 2001.","“1 dead, 17 injured in bombing in Colombian province,” Deutsche Presse Agentur, August 24, 2001.",CETIS,0,0,0,0,
2551,23263,200108230017,2001,8,23,,0,,45,Colombia,3,South America,Antioquia,Medellin,6.242759,-75.596075,1.0,0,In the Laureles area of Medellin,"08/23/2001: At least ten people were injured when a car bomb exploded outside the Radio Caracol office in Medellin, Antioquia department, Colombia around 9:00pm.  No group claimed responsibility for the incident.  The damage was described as serious.",1,1,1,0,,,0,1,0,3,Bombing/Explosion,,,,,10,Journalists & Media,54.0,Radio Journalist/Staff/Facility,Radio Caracol office,Radio Caracol office in Medellin,45.0,Colombia,14.0,Private Citizens & Property,79.0,"Public Area (garden, parking lot, garage, beach, public building, camp)",Citizens and property in Medellin,Citizens and property in the vicinity of the explosion,45.0,Colombia,,,,,,,,,Unknown,,,,,,"Although the specific motive was unknown, sources described how the National Liberation Army (ELN) had been active in the area.",0.0,,,-99.0,0.0,0.0,,,,,,,,,,6,Explosives/Bombs/Dynamite,16.0,Unknown Explosive Type,,,,,,,,,,,,,The bomb was in a car and was described as powerful.,0.0,0.0,0.0,10.0,0.0,0.0,1,4.0,Unknown,,"Sources describe the damage as serious, and authorities say a hole five feet in diameter was left at the site of the explosion.",0.0,,,,,,,,,,,,,,,,,"""Bomb explodes in Colombia's third-largest city,"" Reuters, August 23, 2001.","""New explosion leaves another 10 wounded in Colombia,"" Agence France-Presse, August 24, 2001.",,UMD Schmid 2012,-9,-9,0,-9,
2552,23267,200108230021,2001,8,23,,0,,45,Colombia,3,South America,Antioquia,Medellin,6.242759,-75.596075,1.0,0,,"08/23/2001: A bomb exploded behind the offices of Radio Caracol in Medellin, Colombia in an attack by the National Liberation Army (ELN). 35 people were wounded.",1,1,1,0,,,0,1,0,3,Bombing/Explosion,,,,,10,Journalists & Media,54.0,Radio Journalist/Staff/Facility,Colombian Radio Broadcasting,"Offices of Radio Caracol in Medellin, Colombia",45.0,Colombia,,,,,,,,,,,,,,,,,Unknown,,,,,,Unknown,0.0,,,,0.0,0.0,,,,,,,,,,6,Explosives/Bombs/Dynamite,16.0,Unknown Explosive Type,,,,,,,,,,,,,,0.0,0.0,0.0,20.0,0.0,0.0,1,2.0,Major (likely > $1 million but < $1 billion),,"Several buildings were partially destroyed, while many others suffered lesser damage. The blast took place close to a local radio station, causing significant damage to the installations.",0.0,,,,,,,,,,,,,,,,,"“21 dead, 25 wounded in attacks around, Agence France Presse, August 24, 2001.","Martin Dayani, “Blast rocks Colombia's second city,” United Press International, August 24, 2001.",,CETIS,-9,-9,0,-9,
2553,23285,200108240013,2001,8,24,,0,,45,Colombia,3,South America,Norte de Santander,Cucuta,7.894195,-72.503885,1.0,0,,"08/24/2001: A car bomb placed by in front of the State house by suspected members of the National Liberation Army (ELN) exploded in Cucuta, Colombia. No injuries occurred but departmental government offices and several businesses were damaged in the explosion.",1,1,1,0,,,0,1,0,3,Bombing/Explosion,,,,,2,Government (General),21.0,Government Building/Facility/Office,Norte de Santander Department,Norte de Santander State House,45.0,Colombia,,,,,,,,,,,,,,,,,National Liberation Army of Colombia (ELN),,,,,,Unknown,1.0,,,,0.0,0.0,,,,,,,,,,6,Explosives/Bombs/Dynamite,16.0,Unknown Explosive Type,,,,,,,,,,,,,,0.0,0.0,0.0,0.0,0.0,0.0,1,2.0,Major (likely > $1 million but < $1 billion),,"The bomb exploded on the street in front of the State house, destroying its gates and damaging nearby businesses.",0.0,,,,,,,,,,,,,,,,,"“Car Bombs Explode in Colombia,” Xinhua General News Service, August 24, 2001.","“AFX World news update - Eighteen killed during clashes in Indian Kashmir,” AFX European Focus, August 24, 2001.","Javier Baena, “Rebel bombing campaign spreads to eastern capital,” Associated Press Worldstream, August 24, 2001.",CETIS,0,0,0,0,
2554,23302,200108250013,2001,8,25,,0,,45,Colombia,3,South America,Huila,Santa Maria,2.936848,-75.586642,1.0,0,,"08/25/2001: About 450 members of the Revolutionary Armed Forces of Columbia (FARC) in a strike on Santa Maria, Huila Department, attacked the Santa Juana de Arco School, the police station, the National Registry building, and the municipal court using gas cylinders, other explosives, and M-60 machine guns. Houses were destroyed and various items looted. Three soldiers were wounded but no other injuries were reported.",1,1,1,0,,,0,1,0,3,Bombing/Explosion,2.0,Armed Assault,,,2,Government (General),21.0,Government Building/Facility/Office,Colombian towns and property,"Santa Maria, Huila Department, Colombia",45.0,Colombia,,,,,,,,,,,,,,,,,Revolutionary Armed Forces of Colombia (FARC),,,,,,"Jose Zacarandai, a Tolima Indian who sells perishable goods, was the target of the guerrilla action.",1.0,,,450.0,0.0,0.0,,,,,,,,,,6,Explosives/Bombs/Dynamite,17.0,Other Explosive Type,5.0,Firearms,2.0,Automatic Weapon,,,,,,,,,"Gas cylinder bombs and other explosives were thrown, and M-60 machine guns were used in the attack.",0.0,0.0,0.0,3.0,0.0,0.0,1,2.0,Major (likely > $1 million but < $1 billion),,Various buildings and homes were destroyed and a number of items were looted.,0.0,,,,,,,,,,,,,,,,,"“FARC Attacks Santa Maria, Huila; Police Station Partially Destroyed,” Caracol Colombia Radio, August 26, 2001.",,,CETIS,0,0,0,0,
2555,23312,200108250023,2001,8,25,,1,,45,Colombia,3,South America,Atlantico,Campo de la Cruz,10.380159,-74.88082,1.0,0,,"08/25/2001: Amauris Esther Cantillo, the wife of politician Humberto Munoz, the vice-president of the Democratic Alternative Movement, was kidnapped from her home by six unidentified armed men in Campo de la Cruz Municipality, Atlantico Department, Colombia.",1,1,1,0,,,0,1,0,6,Hostage Taking (Kidnapping),,,,,14,Private Citizens & Property,68.0,Named Civilian,Civilians,Amauris Esther Cantillo,45.0,Colombia,2.0,Government (General),15.0,Politician or Political Party Movement/Meeting/Rally,Democratic Alternative Movement,"Humberto Munoz, the vice-president of the Democratic Alternative Movement",45.0,Colombia,,,,,,,,,Unknown,,,,,,Unknown,0.0,,,6.0,0.0,0.0,,,,,,,,,,5,Firearms,5.0,Unknown Gun Type,,,,,,,,,,,,,,0.0,0.0,0.0,0.0,0.0,0.0,0,,,,,1.0,1.0,0.0,,-99.0,,,,,,,,,,,,,"“Colombian Guerrilla, Paramilitary Activities 27 Aug,” FBIS, August 28, 2001.",,,CETIS,-9,-9,0,-9,
2556,23367,200108280008,2001,8,28,,0,,45,Colombia,3,South America,Cordoba,Puerto Libertador district,7.89014,-75.66967,3.0,0,,"08/28/2001: Six people were killed and six people wounded in an attack by at least 20 men of the Revolutionary Armed Forces of Colombia (FARC) on Puerto Libertador Municipality, Cordoba Department, Colombia",1,1,1,0,,,0,1,0,7,Facility/Infrastructure Attack,,,,,14,Private Citizens & Property,75.0,Village/City/Town/Suburb,Colombian Villages,"Puerto Libertador Municipality in Cordoba Department, Colombia",45.0,Colombia,,,,,,,,,,,,,,,,,Revolutionary Armed Forces of Colombia (FARC),,,,,,Unknown,0.0,,,20.0,0.0,0.0,,,,,,,,,,13,Unknown,,,,,,,,,,,,,,,,6.0,0.0,0.0,6.0,0.0,0.0,1,4.0,Unknown,,,0.0,,,,,,,,,,,,,,,,,"“Colombian Guerrilla, Paramilitary Activities 28 Aug,” FBIS, August 28, 2001.",,,CETIS,0,0,0,0,
2557,23372,200108280013,2001,8,28,,1,,45,Colombia,3,South America,Huila,Unknown,2.535935,-75.52767,4.0,0,,"08/28/2001: Orlando Beltran of the Liberal Party was kidnapped at gunpoint from his vehicle in Huila Department, Columbia by members of the Revolutionary Armed Forces of Colombia (FARC).",1,1,1,0,,,0,1,0,6,Hostage Taking (Kidnapping),,,,,2,Government (General),15.0,Politician or Political Party Movement/Meeting/Rally,Liberal Party,Orlando Beltran,45.0,Colombia,,,,,,,,,,,,,,,,,Revolutionary Armed Forces of Colombia (FARC),,,,,,Unknown,0.0,,,,0.0,0.0,,,,,,,,,,5,Firearms,5.0,Unknown Gun Type,,,,,,,,,,,,,,0.0,0.0,0.0,0.0,0.0,0.0,0,,,,,1.0,1.0,0.0,,-99.0,,,,,,,,,7.0,Unknown,,,"“Colombian opposition lawmaker kidnapped in south,” Agence France Presse, August 29, 2001.","Colombian lawmaker kidnapped as bad weather slows offensive,” Agence France Presse, August 29, 2001.","“Colombian Congress threatens to strike over FARC kidnappings,” BBC Monitoring Latin America – Political, August 30, 2001.",CETIS,0,0,0,0,
2558,23376,200108280017,2001,8,28,,0,,45,Colombia,3,South America,Narino,Puerres,0.8845719999999999,-77.503387,1.0,0,The incident occurred 7 km from Puerres.,"08/28/2001: A portion of the Trans-Andean Pipeline was destroyed by a Revolutionary Armed Forces of Colombia (FARC) attack near Puerres, southern Narino Department, Colombia. No injuries were caused.",1,1,1,0,,,0,1,0,3,Bombing/Explosion,,,,,21,Utilities,108.0,Oil,Trans-Andean Pipelin,"Portion of the Trans-Andean Pipeline near Puerras, Narino Department, Colombia",45.0,Colombia,,,,,,,,,,,,,,,,,Revolutionary Armed Forces of Colombia (FARC),,,,,,To negatively affect oil production and revenue.,0.0,,,,0.0,0.0,,,,,,,,,,6,Explosives/Bombs/Dynamite,16.0,Unknown Explosive Type,,,,,,,,,,,,,,0.0,0.0,0.0,0.0,0.0,0.0,1,2.0,Major (likely > $1 million but < $1 billion),,A portion of oil pipeline was destroyed.,0.0,,,,,,,,,,,,,,,,Oil production provided a significant revenue source for the Colombian government.,"“Colombian Guerrilla, Paramilitary Activities 30 Aug,” FBIS, August 30, 2001.",,,CETIS,0,0,0,0,
2559,23379,200108280020,2001,8,28,,0,,45,Colombia,3,South America,La Guajira,La Loma,11.30613,-72.34137,1.0,0,,"08/28/2001: An explosive device was found and defused on a railway from the Cerrejon coal mine to Puerto Bolivar near La Lima in Guajira Department, Colombia. No perpetrators were identified.",1,1,1,0,,,0,0,0,3,Bombing/Explosion,,,,,19,Transportation,100.0,Train/Train Tracks/Trolley,Colombian Railway System,"Railway from the Cerrejon coal mine to Puerto Bolivar in Guajira Department, Colombia",45.0,Colombia,1.0,Business,10.0,Mining,Cerrejon Northern Zone coal mine,Railroad infrastructure of the coal complex,45.0,Colombia,,,,,,,,,Unknown,,,,,,Unknown,0.0,,,,0.0,0.0,,,,,,,,,,6,Explosives/Bombs/Dynamite,16.0,Unknown Explosive Type,,,,,,,,,,,,,,0.0,0.0,0.0,0.0,0.0,0.0,0,,,,,0.0,,,,,,,,,,,,,,,,,"“Colombian Guerrilla, Paramilitary Activities 28 Aug,” FBIS, August 28, 2001.",,,CETIS,-9,-9,0,-9,
2560,23383,200108290001,2001,8,29,,0,,45,Colombia,3,South America,Bolivar,San Pablo,7.48008,-73.92076,1.0,1,"The incident occurred on the San Pablo-Simiti road, 6 km away from San Pablo.","08/29/2001: Two car bombs were planted by National Liberation Front (ELN) members on the San Pablo-Simiti road, 6 km away from San Pablo, in southern Bolivar Department, Colombia. The vehicles were marked with the message ""car-bomb"" by the ELN. The bombs were found and detonated by the security services.",1,1,1,0,,,0,0,0,3,Bombing/Explosion,,,,,14,Private Citizens & Property,67.0,Unnamed Civilian/Unspecified,Civilians,"Civilians on the San Pablo-Simiti road in southern Bolivar Department, Colombia",45.0,Colombia,,,,,,,,,,,,,,,,,National Liberation Army of Colombia (ELN),,,,,,Unknown,1.0,,,,0.0,0.0,,,,,,,,,,6,Explosives/Bombs/Dynamite,16.0,Unknown Explosive Type,,,,,,,,,,,,,A car bomb was used in the attack.,0.0,0.0,0.0,0.0,0.0,0.0,1,3.0,Minor (likely < $1 million),,The vehicles used in the car bombs were stolen.,0.0,,,,,,,,,,,,,,,,,"“Colombian Guerrilla, Paramilitary Activities 30 Aug,” FBIS, August 30, 2001.","“Colombia's Police Detonate Two Car Bombs,” Xinhua General News Service, August 31, 2001.",,CETIS,0,0,0,0,
2561,23385,200108290003,2001,8,29,,0,,45,Colombia,3,South America,Antioquia,Caramanta,5.548323,-75.6441,1.0,0,,"08/29/2001: Five people were killed by the United Self Defense Forces (AUC) in Caramanta, Antioquia Department, Colombia. No further information was available.",1,1,1,0,,,0,1,0,9,Unknown,,,,,14,Private Citizens & Property,67.0,Unnamed Civilian/Unspecified,Civilians,"Civilians in Caramanta, Antioquia Department, Colombia",45.0,Colombia,,,,,,,,,,,,,,,,,United Self Defense Units of Colombia (AUC),,,,,,Unknown,0.0,,,,,0.0,,,,,,,,,,13,Unknown,,,,,,,,,,,,,,,,5.0,0.0,0.0,0.0,0.0,0.0,0,,,,,0.0,,,,,,,,,,,,,,,,,"“Colombian Guerrilla, Paramilitary Activities 29 Aug,” FBIS, August 29, 2001.",,,CETIS,0,0,0,0,
2562,23392,200108290010,2001,8,29,,0,,45,Colombia,3,South America,Norte de Santander,Tibu district,8.63781,-72.73464,3.0,0,The incident occurred on the Tibu-Cucuta road in Norte de Santander Department.,"08/29/2001: The Maria Yamile bridge over the Nuevo Presidente River on the Tibu-Cucuta road was destroyed in a bombing by the National Liberation Army (ELN) in Norte de Santander Department, Colombia. No injuries were reported.",1,1,1,0,,,0,1,0,3,Bombing/Explosion,,,,,19,Transportation,103.0,Bridge/Car Tunnel,Colombian Highway System,"Maria Yamile bridge over the Nuevo Presidente River in Norte de Santander Department, Colombia",45.0,Colombia,,,,,,,,,,,,,,,,,National Liberation Army of Colombia (ELN),,,,,,Unknown,1.0,,,,0.0,0.0,,,,,,,,,,6,Explosives/Bombs/Dynamite,16.0,Unknown Explosive Type,,,,,,,,,,,,,,0.0,0.0,0.0,0.0,0.0,0.0,1,2.0,Major (likely > $1 million but < $1 billion),,A bridge was destroyed in the attack.,0.0,,,,,,,,,,,,,,,,This was the third time in the last 15 months that this bridge was bombed by the ELN.,"“Colombian Guerrilla, Paramilitary Activities 29 Aug,” FBIS, August 29, 2001.",,,CETIS,0,0,0,0,
2563,23396,200108290014,2001,8,29,,1,,45,Colombia,3,South America,Cesar,Caracolicito,10.195424,-73.972736,1.0,0,,"08/29/2001: Ten people were kidnapped and three trucks stolen at a National Liberation Army (ELN) checkpoint at Caracolicito on the border between Magdalena and Cesar Departments, Colombia.",1,1,1,0,,,0,1,0,6,Hostage Taking (Kidnapping),,,,,14,Private Citizens & Property,67.0,Unnamed Civilian/Unspecified,Civilians,"Civilians on the highway between Magdalena Department and Cesar Department, Colombia",45.0,Colombia,,,,,,,,,,,,,,,,,National Liberation Army of Colombia (ELN),,,,,,Unknown,1.0,,,,0.0,0.0,,,,,,,,,,13,Unknown,,,,,,,,,,,,,,,,0.0,0.0,0.0,0.0,0.0,0.0,1,3.0,Minor (likely < $1 million),,Three trucks with food items were stolen.,1.0,10.0,0.0,,-99.0,,,,,,,,,7.0,Unknown,-99.0,,"“Colombian Guerrilla, Paramilitary Activities 29 Aug,” FBIS, August 29, 2001.",,,CETIS,0,0,0,0,
2564,23415,200108300007,2001,8,30,,0,,45,Colombia,3,South America,Caqueta,Puerto Rico,1.90967,-75.15906,1.0,1,The incident occurred in the outskirts of Puerto Rico.,"08/30/2001: Jose Lizardo Rojas, the mayor of Puerto Rico, Colombia, was shot and killed by armed men on the outskirts of the town in Caqueta Department, Colombia. The incident was blamed on the Revolutionary Armed Forces of Colombia (FARC).",1,1,1,0,,,0,1,0,1,Assassination,,,,,2,Government (General),18.0,"Government Personnel (excluding police, military)","Mayor of Puerto Rico, Colombia",Jose Lizardo Rojas,45.0,Colombia,,,,,,,,,,,,,,,,,Revolutionary Armed Forces of Colombia (FARC),,,,,,Unknown,1.0,,,,0.0,0.0,,,,,,,,,,5,Firearms,5.0,Unknown Gun Type,,,,,,,,,,,,,,1.0,0.0,0.0,0.0,0.0,0.0,0,,,,,0.0,,,,,,,,,,,,,,,,,"Jose Ramos, “US delegation visits Colombia amid surge of violence,” Agence France Presse, August 31, 2001.","“Hired Assassins Murder Puerto Rico Mayor,” Radio Cadena Nacional, August 31, 2001.",,CETIS,0,0,0,0,
