2693,24317,200204030004,2002,4,3,,1,,45,Colombia,3,South America,Arauca,Saravena,6.952839999999999,-71.87514,1.0,0,,"4/3/2002:  Suspected members of Revolutionary Armed Forces of Colombia (FARC) kidnapped the mayor of Saravena, Arauca Department, Colombia.  Mayor Jose Trinidad Sierra, along with three councilmen, were abducted by armed assailants.  No ransom demands were made.",1,1,1,0,,,0,1,0,6,Hostage Taking (Kidnapping),,,,,2,Government (General),18.0,"Government Personnel (excluding police, military)",Colombian mayor and councilmen,"Jose Trinidad Sierra, mayor of Saravena, and councilors Sebastian Vera Alvarado y Saravena, Alvaro Salinas Rodriguez and Fernando Serrano",45.0,Colombia,,,,,,,,,,,,,,,,,Revolutionary Armed Forces of Colombia (FARC),,,,,,"Specific motive is unknown; however, sources note that politicians are often kidnapped in order to intimidate or collect ransom",1.0,,,-99.0,0.0,0.0,,,,,,,,,,12,Other,,,,,,,,,,,,,,,No specific mention of weapons was made,0.0,0.0,0.0,0.0,0.0,0.0,0,,,,,1.0,4.0,0.0,-99.0,-99.0,,,-9.0,,,,,,7.0,Unknown,-99.0,,"""Colombia bombs military rebels - claims dozens killed; two mayors kidnapped,"" Associated Press, April 3, 2002.","""U.N. Calls for End to Kidnappings in Colombia,"" Xinhua General News Service, April 6, 2002.","""Suspected Colombian rebels kidnap two mayors, three councilmen,"" EFE News Service, April 4, 2002.",UMD Schmid 2012,0,0,0,0,
2694,24322,200204070001,2002,5,4,,0,,45,Colombia,3,South America,Tolima,Rovira,4.243193,-75.24112099999998,1.0,0,,"5/4/2002: Approximately 100 members from Revolutionary Armed Forces of Colombia (FARC) attacked the town of Rovira, Tolima Department, Colombia.  The assailants detonated explosive devices at the police station, a bank, and various other public buildings and private homes.  They also planted mines on access roads leading into Rovira.  A soldier and a police officer were killed in the attack and two civilians were wounded.",1,1,1,0,,,0,1,0,3,Bombing/Explosion,,,,,1,Business,,,Public buildings and businesses,"Various buildings and businesses, including a bank, a telecommunication company, and other stores",45.0,Colombia,3.0,Police,22.0,"Police Building (headquarters, station, school)",Police station,The police station in Rovira,45.0,Colombia,14.0,Private Citizens & Property,76.0,House/Apartment/Residence,Civilians and civilian property,Private homes and civilians in Rovira,45.0,Colombia,Revolutionary Armed Forces of Colombia (FARC),,,,,,Unknown,0.0,,,100.0,-99.0,0.0,,,,,,,,,,6,Explosives/Bombs/Dynamite,8.0,Land Mine,,,,,,,,,,,,,,2.0,0.0,0.0,2.0,0.0,0.0,1,4.0,Unknown,,Various private and public buildings were destroyed,0.0,,,,,,,,,,,,,,,,One less-credible source states that the incident was perpetrated in order to rob a bank.,"""Two killed in FARC attack on Colombian town,"" EFE News Service, May 4, 2002.","""FARC guerrillas attack Rovira - Tolima; One policeman dead,"" Medellin El Colombiano, May 6, 2002.",,UMD Schmid 2012,0,0,0,0,
2695,24323,200204070002,2002,4,7,,0,,45,Colombia,3,South America,Meta,Villavicencio,4.1512699999999985,-73.63871999999998,1.0,0,"In the restaurant and nightclub district of Villavicencio, 113 kilometers southeast of Bogota","4/7/2002: A car bomb exploded in the busy entertainment district of Villavicencio, Meta department, Colombia.  A smaller device exploded first, drawing a crowd; it was followed by a powerful car bomb that damaged nearby buildings.  At least twelve people were killed and at least another 70 were injured.  No group claimed responsibility for the incident; however, authorities speculate that Revolutionary Armed Forces of Colombia (FARC) were involved.",1,1,1,0,,,0,1,0,3,Bombing/Explosion,,,,,14,Private Citizens & Property,67.0,Unnamed Civilian/Unspecified,Civilians,Civilians in the entertainment district,45.0,Colombia,1.0,Business,11.0,Entertainment/Cultural/Stadium/Casino,Entertainment businesses,"Businesses located in the entertainment district, including a radio station.",45.0,Colombia,,,,,,,,,Revolutionary Armed Forces of Colombia (FARC),,,,,,"Specific motive is unknown; however, polls open on May 26 and one of the candidates has promised to crack down on rebel activity.",1.0,,,-99.0,0.0,0.0,,,,,,,,,,6,Explosives/Bombs/Dynamite,15.0,Vehicle,,,,,,,,,,,,,A car packed with 110 pounds of explosives,12.0,0.0,0.0,70.0,0.0,0.0,1,4.0,Unknown,,Cars and buildings were damaged,0.0,,,,,,,,,,,,,,,,One source states that 70 people were injured while another source states that 100 were injured.,"Jose Ramos, ""Colombia car bomb kills 12, injures 100; gunmen kill another priest,"" Agence France Presse, April 7, 2002.","Ibon Villelabeitia, ""Car bomb kills 12 in Colombia,"" Reuters, April 7, 2002.",,UMD Encyclopedia of World Terrorism 2012,0,0,0,0,
2697,24327,200204090002,2002,4,9,,0,,45,Colombia,3,South America,Bogota,Bogota,4.5981,-74.07603,1.0,0,,"4/9/2002: An improvised explosive device detonated outside of a bookstore in Bogota, Distrito Capital, Colombia.  The device consisted of explosives packed into a gas cylinder.  At least one person was injured in the attack.  Authorities blame the Revolutionary Armed Forces of Colombia (FARC) for the incident.  This was one of several bombs that were attributed to FARC that day.",1,1,1,0,,,1,1,0,3,Bombing/Explosion,,,,,1,Business,7.0,Retail/Grocery/Bakery,A book store,A book store in Bogota,45.0,Colombia,,,,,,,,,,,,,,,,,Revolutionary Armed Forces of Colombia (FARC),,,,,,"Specific motive is unknown; however, authorities note that the incident occurred on the same day that Jorge Eliecer Gaitan was assassinated in 1948.  They believe that the incident was a commemoration.",1.0,,,-99.0,0.0,0.0,,,,,,,,,,6,Explosives/Bombs/Dynamite,16.0,Unknown Explosive Type,,,,,,,,,,,,,Explosives packed into a gas cylinder,0.0,0.0,0.0,1.0,0.0,0.0,-9,,,,,0.0,,,,,,,,,,,,,,,,,"""Three bombs explode in Bogota - rebels blamed,"" Reuters News, April 10, 2002.","""Colombia: Five low-powered bombs go off in Bogota - 4 injured,"" Bogota Radio Cadena Nacional, April 9, 2002/","""Two military die In macabre car-corpse bomb explosion,"" Bogota El Tiempo, April 9, 2002.",UMD Schmid 2012,0,0,0,0,"200204090003, 200204090004, 200204090005"
2698,24328,200204090003,2002,4,9,,0,,45,Colombia,3,South America,Bogota,Bogota,4.5981,-74.07603,1.0,0,,"4/9/2002: An improvised explosive device detonated outside of a cellular phone store in Bogota, Distrito Capital, Colombia.  The device consisted of explosives packed into a gas cylinder.  At least one person was injured in the attack.  Authorities blame the Revolutionary Armed Forces of Colombia (FARC) for the incident. This was one of several bombs that were attributed to FARC that day.",1,1,1,0,,,1,1,0,3,Bombing/Explosion,,,,,1,Business,7.0,Retail/Grocery/Bakery,A cellular phone company,A cellular phone company in Bogota,45.0,Colombia,,,,,,,,,,,,,,,,,Revolutionary Armed Forces of Colombia (FARC),,,,,,"Specific motive is unknown; however, authorities note that the incident occurred on the same day that Jorge Eliecer Gaitan was assassinated in 1948.  They believe that the incident was a commemoration.",1.0,,,-99.0,0.0,0.0,,,,,,,,,,6,Explosives/Bombs/Dynamite,16.0,Unknown Explosive Type,,,,,,,,,,,,,Explosives packed into a gas cylinder,0.0,0.0,0.0,1.0,0.0,0.0,-9,,,,,0.0,,,,,,,,,,,,,,,,,"""Three bombs explode in Bogota - rebels blamed,"" Reuters News, April 10, 2002.","""Colombia: Five low-powered bombs go off in Bogota - 4 injured,"" Bogota Radio Cadena Nacional, April 9, 2002/","""Two military die In macabre car-corpse bomb explosion,"" Bogota El Tiempo, April 9, 2002.",UMD Schmid 2012,0,0,0,0,"200204090002, 200204090004, 200204090005"
2699,24329,200204090004,2002,4,9,,0,,45,Colombia,3,South America,Bogota,Bogota,4.5981,-74.07603,1.0,0,Two blocks from the presidential palace,"4/9/2002: An improvised explosive device detonated outside of an apartment building in Bogota, Distrito Capital, Colombia.  The device consisted of explosives packed into a gas cylinder.  At least one person was injured in the attack.  Authorities blame the Revolutionary Armed Forces of Colombia (FARC) for the incident.  This was one of several bombs that were attributed to FARC that day.",1,1,1,0,,,1,1,0,3,Bombing/Explosion,,,,,14,Private Citizens & Property,76.0,House/Apartment/Residence,An apartment building,An apartment building in Bogota,45.0,Colombia,,,,,,,,,,,,,,,,,Revolutionary Armed Forces of Colombia (FARC),,,,,,"Specific motive is unknown; however, authorities note that the incident occurred on the same day that Jorge Eliecer Gaitan was assassinated in 1948.  They believe that the incident was a commemoration.",1.0,,,-99.0,0.0,0.0,,,,,,,,,,6,Explosives/Bombs/Dynamite,16.0,Unknown Explosive Type,,,,,,,,,,,,,Explosives packed into a gas cylinder,0.0,0.0,0.0,1.0,0.0,0.0,-9,,,,,0.0,,,,,,,,,,,,,,,,,"""Three bombs explode in Bogota - rebels blamed,"" Reuters News, April 10, 2002.","""Colombia: Five low-powered bombs go off in Bogota - 4 injured,"" Bogota Radio Cadena Nacional, April 9, 2002/","""Two military die In macabre car-corpse bomb explosion,"" Bogota El Tiempo, April 9, 2002.",UMD Schmid 2012,0,0,0,0,"200204090002, 200204090003, 200204090005"
2700,24330,200204090005,2002,4,9,,0,,45,Colombia,3,South America,Bogota,Bogota,4.5981,-74.07603,1.0,0,,"4/9/2002: A bomb-sniffing dog uncovered an explosive device in Bogota, Distrito Capital, Colombia.  Experts safely defused the device.  Authorities blame the Revolutionary Armed Forces of Colombia (FARC) for the failed attempt.  This was one of several bombs that were attributed to FARC that day.",1,1,1,0,,,1,0,0,3,Bombing/Explosion,,,,,20,Unknown,,,Unknown,Unknown,45.0,Colombia,,,,,,,,,,,,,,,,,Revolutionary Armed Forces of Colombia (FARC),,,,,,"Specific motive is unknown; however, authorities note that the incident occurred on the same day that Jorge Eliecer Gaitan was assassinated in 1948.  They believe that the incident was a commemoration.",1.0,,,-99.0,0.0,0.0,,,,,,,,,,6,Explosives/Bombs/Dynamite,16.0,Unknown Explosive Type,,,,,,,,,,,,,,0.0,0.0,0.0,0.0,0.0,0.0,0,,,,,0.0,,,,,,,,,,,,,,,,,"""Three bombs explode in Bogota - rebels blamed,"" Reuters News, April 10, 2002.","""Colombia: Five low-powered bombs go off in Bogota - 4 injured,"" Bogota Radio Cadena Nacional, April 9, 2002/","""Two military die In macabre car-corpse bomb explosion,"" Bogota El Tiempo, April 9, 2002.",UMD Schmid 2012,0,0,0,0,"200204090002, 200204090003, 200204090004"
2704,24349,200204140001,2002,4,14,,0,,45,Colombia,3,South America,Atlantico,Barranquilla,10.981412,-74.778319,1.0,0,,"04/14/2002: A car-bomb exploded along Colombian Presidential Candidate Alvaro Uribe Velez's campaign route in Barranquilla as he traveled to the Port Authority headquarters. The bomb destroyed Uribe's armored car and a bus. Uribe was not killed. There were 3 civilian causalties and approximately 20 injured. There were no claims of responsibility, though the Fuerzas Armadas Revolucionarias de Colombia (FARC)is suspected.",1,1,1,0,,,0,0,0,1,Assassination,,,,,2,Government (General),18.0,"Government Personnel (excluding police, military)",Civilians,Civilians in Barranquilla,45.0,Colombia,2.0,Government (General),15.0,Politician or Political Party Movement/Meeting/Rally,Presidential candidate,Alvaro Uribe,45.0,Colombia,,,,,,,,,Revolutionary Armed Forces of Colombia (FARC),,,,,,Unknown,1.0,,,,0.0,0.0,,,,,,,,,,6,Explosives/Bombs/Dynamite,16.0,Unknown Explosive Type,,,,,,,,,,,,,,3.0,0.0,0.0,20.0,0.0,0.0,0,,,,,0.0,,,,,,,,,,,,,,,,,"""Colombia's presidential candidate Alvaro Uribe emerges unscathed from terrorist attack,"" Caracas Globovision Television, 04/14/2002.","""Colombian presidential candidate survives assassination attempt."" Middle East News Online, 04/15/2002.","""Political candidate survives Colombian bridge explosion,"" The Globe and Mail, 04/15/2002.",CETIS,0,0,0,0,
2705,24361,200204170001,2002,4,17,,1,,45,Colombia,3,South America,Boyaca,Chiscas,6.552373,-72.49969200000002,1.0,0,"The mayor's office in Chiscas, north of Tunja","4/17/2002: Members of Revolutionary Armed Forces of Colombia (FARC) kidnapped Mayor Reynaldo Davila Rincon, from his office in Chiscas, Boyaca Department, Colombia.  Specific motive is unknown; however, it is suspected that he will be forced to participate in an trial for allowing municipal elections to occur when FARC prohibited them.",1,1,1,0,,,0,1,0,6,Hostage Taking (Kidnapping),,,,,2,Government (General),18.0,"Government Personnel (excluding police, military)",Colombian mayor,"Reynaldo Davila Rincon, mayor of Chiscas",45.0,Colombia,,,,,,,,,,,,,,,,,Revolutionary Armed Forces of Colombia (FARC),,,,,,"Specific motive is unknown; however, it is suspected that the mayor will be forced to participate in an trial for allowing municipal elections to occur when FARC prohibited them.",0.0,,,-99.0,0.0,0.0,,,,,,,,,,13,Unknown,,,,,,,,,,,,,,,No specific mention of weapons was made,0.0,0.0,0.0,0.0,0.0,0.0,0,,,,,1.0,1.0,0.0,-99.0,-99.0,,,-9.0,,,,,,7.0,Unknown,-99.0,,"""Chiascas Mayor Kidnapped,"" Bogota El Tiempo, April 22, 2002.",,,UMD Schmid 2012,0,0,0,0,
2707,24368,200204190004,2002,4,19,,1,,45,Colombia,3,South America,Cauca,Rosas,2.261312,-76.74141999999998,1.0,1,"On the Popayan-Pasto road between Timbio and Rosas, 390 kilometers from Bogota","4/19/2002: Members of National Liberation Army of Colombia (ELN) kidnapped at least six people near Rosas town in Cauca Department, Colombia.  The rebels set up a roadblock and stopped several vehicles, kidnapping Jesus Salazar, the mayor of Rosas, and at least five other people.  Specific motive is unknown; however, several days before the kidnapping, Salazar had led a march requesting that the rebels leave Rosas town alone.  The outcome of the kidnapping is unknown.",1,1,1,0,,,0,1,0,6,Hostage Taking (Kidnapping),,,,,2,Government (General),18.0,"Government Personnel (excluding police, military)",Colombian mayor,"Jesus Salazar, the mayor of Rosas town",45.0,Colombia,14.0,Private Citizens & Property,67.0,Unnamed Civilian/Unspecified,Civilians,Civilians stopped at a roadblock near Rosas town,45.0,Colombia,,,,,,,,,National Liberation Army of Colombia (ELN),,,,,,"Specific motive is unknown; however, several days before the kidnapping, Salazar had led a march requesting that the rebels leave Rosas town alone.",0.0,,,-99.0,0.0,0.0,,,,,,,,,,13,Unknown,,,,,,,,,,,,,,,No specific mention of weapons was made,0.0,0.0,0.0,0.0,0.0,0.0,0,,,,,1.0,6.0,0.0,-99.0,-99.0,,,-9.0,,,,,,7.0,Unknown,-9.0,"Two sources states that six people were kidnapped, while one source states that seven people were kidnapped.","""Rebels kidnap mayor - five others in southwest Colombia,"" Dow Jones International News, April 20, 2002.","""At least six people kidnapped by ELN guerrillas,"" EFE News Service, April 21, 2002.","""Seven kidnapped by ELN between Cauca and Narino Departments,"" Bogota El Tiempo, April 22, 2002.",UMD Schmid 2012,0,0,0,0,
2708,24369,200204190005,2002,4,19,,1,,45,Colombia,3,South America,Valle del Cauca,Cali,3.425219,-76.510584,1.0,1,The helicopter departed Cali and was somewhere between Cauca and Narino Departments when the incident occurred.,"4/19/2002: Members of Revolutionary Armed Forces of Colombia (FARC) hijacked a private helicopter and its four passengers after it departed from Cali, Valle del Cauca Department, Colombia.  The helicopter was traveling from Canada to Bolivia and was carrying two Canadians, an Ecuadoran, and a French citizen.  The motive behind the incident is unknown, as is the outcome of the kidnapping.",1,1,1,0,,,0,1,0,6,Hostage Taking (Kidnapping),,,,,14,Private Citizens & Property,,,Civilians,"Two Canadians, an Ecuadoran, and a French citizen who were traveling by helicopter from Canada to Bolivia",38.0,Canada,,,,,,,,,,,,,,,,,Revolutionary Armed Forces of Colombia (FARC),,,,,,Unknown,0.0,,,-99.0,0.0,0.0,,,,,,,,,,13,Unknown,,,,,,,,,,,,,,,No specific mention of weapons was made,0.0,0.0,0.0,0.0,0.0,0.0,0,,,,,1.0,4.0,0.0,-99.0,-99.0,,,-9.0,,,,,,7.0,Unknown,-9.0,"Media reports that more than two weeks following the kidnapping, authorities still had not received demands for the release of the abductees.  The missing people were Guilles Pregent, Pierre Gallipon, and Jay Rideni.  The name of the Ecuadoran is unknown.","""Authorities report more kidnaps by FARC - helicopter hijacked by FARC,"" El Espectador, May 4, 2002.","""2 Canadians among 4 hostages taken by Colombian rebels,"" Reuters News, May 03, 2002.","""FARC hijacked helicopter with four foreigners aboard: general,"" Agence France Presse, May 3, 2002.",UMD Schmid 2012,0,1,1,1,
2709,24380,200204230001,2002,4,0,04/23/2002,1,,45,Colombia,3,South America,Unknown,Unknown,,,5.0,0,Pan-American Highway on the Boyaca-Cundinamarca Border,"4/23/2002: Ten uniformed members of Revolutionary Armed Forces of Colombia (FARC) set up an illegal checkpoint on the Pan-American Highway on the  border between Boyaca and Cundinamarca Departments in Colombia.  The guerrillas burned a car and a bus and kidnapped Cesar Cabana, a former interior secretary.  The outcome of the kidnapping is unknown.",1,1,1,0,,,0,1,0,6,Hostage Taking (Kidnapping),2.0,Armed Assault,,,2,Government (General),18.0,"Government Personnel (excluding police, military)",Civilians and civilian property,"Cesar Cabana, a former interior secretary, and two vehicles",45.0,Colombia,,,,,,,,,,,,,,,,,Revolutionary Armed Forces of Colombia (FARC),,,,,,Unknown,0.0,,,10.0,0.0,0.0,,,,,,,,,,5,Firearms,5.0,Unknown Gun Type,8.0,Incendiary,18.0,Arson/Fire,,,,,,,,,Two vehicles were lit on fire,0.0,0.0,0.0,0.0,0.0,0.0,1,4.0,Unknown,,A bus and a car were lit on fire,1.0,1.0,0.0,-99.0,-99.0,,,-9.0,,,,,,7.0,Unknown,-9.0,,"""FARC blocks Pan-American highway on the Boyaca-Cundinamarca border,"" Bogota Caracol Radio, April 23, 2002.",,,UMD Schmid 2012,0,0,0,0,
2710,24391,200204260001,2002,4,26,,0,,45,Colombia,3,South America,Antioquia,Turbo,8.092419999999999,-76.72738000000003,1.0,1,"Montesol plantation near the town of Turbo, in the Uraba region of northwest Colombia, 600 kilometers northwest of Bogota","4/26/2002: Suspected members of Revolutionary Armed Forces of Colombia (FARC) attacked the Montesol plantation near the town of Turbo, Antioquia Department, Colombia.  Nine farm workers were shot and killed and another 18 were wounded in the attack.  The assailants carried a list of names; they forced workers who were named on the list to leave the plantation, then executed them.  Specific motive is unknown.",1,1,1,0,,,0,1,0,2,Armed Assault,,,,,14,Private Citizens & Property,72.0,Farmer,Civilians,Farm workers at Montesol plantation,45.0,Colombia,,,,,,,,,,,,,,,,,Revolutionary Armed Forces of Colombia (FARC),,,,,,"Specific motive is unknown; however, sources speculate that the attack was related to plantation workers' support of a conservative presidential candidate",1.0,,,-99.0,0.0,0.0,,,,,,,,,,5,Firearms,5.0,Unknown Gun Type,,,,,,,,,,,,,,9.0,0.0,0.0,18.0,0.0,0.0,0,,,,,0.0,,,,,,,,,,,,,,,,,"""Rebels blamed for killings of farm worders in Colombia,"" EFE News Service, April 26, 2002.","""FARC guerrillas likely responsible for deaths of nine banana farmers,"" Agence France Presse, April 26, 2002.","""Nine peasants massacred in Uraba,"" Bogota Radio Cadena Nacional, April 26, 2002.",UMD Schmid 2012,0,0,0,0,
2711,24401,200205000001,2002,5,0,"May 31-June 2, 2002",1,,45,Colombia,3,South America,Antioquia,Unknown,7.198606,-75.34121800000001,4.0,0,The Cocorna-San Luis portion of the Medellin-Bogota highway,"5/31/2002: Members of National Liberation Army of Colombia (ELN) kidnapped two merchants on the Medellin-Bogota highway, Antioquia Department, Colombia.  The motive behind the kidnapping is unknown.",1,1,1,0,,,0,1,0,6,Hostage Taking (Kidnapping),,,,,14,Private Citizens & Property,77.0,Laborer (General)/Occupation Identified,Civilians,Two merchants on the Medellin-Bogota highway,45.0,Colombia,,,,,,,,,,,,,,,,,National Liberation Army of Colombia (ELN),,,,,,Unknown,0.0,,,-99.0,0.0,0.0,,,,,,,,,,13,Unknown,,,,,,,,,,,,,,,No specific mention of weapons was made,0.0,0.0,0.0,0.0,0.0,0.0,0,,,,,1.0,2.0,0.0,-99.0,-99.0,,,-9.0,,,,,,7.0,Unknown,-9.0,The motive behind the kidnapping is unknown.  It may have been financially motivated.,"""Weekend kidnapping spree in Antioquia,"" Bogota Caracol Radio, June 5, 2002.",,,UMD Schmid 2012,0,0,0,0,
2712,24402,200205000002,2002,5,0,"May 31-June 2, 2002",1,,45,Colombia,3,South America,Antioquia,Abejorral district,5.790365,-75.428333,3.0,0,"Event occurred in the municipality of Abejorral, Antioquia.","5/31/2002: Members of National Liberation Army of Colombia (ELN) kidnapped a lawyer, Gerardo Alberto Pelaez Montoya, in Abejorral, Antioquia Department, Colombia.  The motive behind the kidnapping is unknown.",1,1,1,0,,,0,1,0,6,Hostage Taking (Kidnapping),,,,,14,Private Citizens & Property,77.0,Laborer (General)/Occupation Identified,Civilians,"Gerardo Alberto Pelaez Montoya, a lawyer",45.0,Colombia,,,,,,,,,,,,,,,,,National Liberation Army of Colombia (ELN),,,,,,Unknown,0.0,,,-99.0,0.0,0.0,,,,,,,,,,13,Unknown,,,,,,,,,,,,,,,No specific mention of weapons was made,0.0,0.0,0.0,0.0,0.0,0.0,0,,,,,1.0,1.0,0.0,-99.0,-99.0,,,-9.0,,,,,,7.0,Unknown,-9.0,The motive behind the kidnapping is unknown.  It may have been financially motivated.,"""Weekend kidnapping spree in Antioquia,"" Bogota Caracol Radio, June 5, 2002.",,,UMD Schmid 2012,0,0,0,0,
2713,24403,200205000003,2002,5,0,"May 31-June 2, 2002",1,,45,Colombia,3,South America,Antioquia,Unknown,7.198606,-75.34121800000001,4.0,0,,"5/31/2002: Members of National Liberation Army of Colombia (ELN) stopped several vehicles and abducted four people in Antioquia Department, Colombia.  The motive behind the kidnapping is unknown.",1,1,1,0,,,0,1,0,6,Hostage Taking (Kidnapping),,,,,14,Private Citizens & Property,73.0,Vehicles/Transportation,Civilians,Four people in several vehicles,45.0,Colombia,,,,,,,,,,,,,,,,,National Liberation Army of Colombia (ELN),,,,,,Unknown,0.0,,,-99.0,0.0,0.0,,,,,,,,,,13,Unknown,,,,,,,,,,,,,,,No specific mention of weapons was made,0.0,0.0,0.0,0.0,0.0,0.0,0,,,,,1.0,4.0,0.0,-99.0,-99.0,,,-9.0,,,,,,7.0,Unknown,-9.0,The motive behind the kidnapping is unknown.  It may have been financially motivated.,"""Weekend kidnapping spree in Antioquia,"" Bogota Caracol Radio, June 5, 2002.",,,UMD Schmid 2012,0,0,0,0,
2714,24414,200205010011,2002,5,1,,0,,45,Colombia,3,South America,Risaralda,Pereira,4.814278,-75.694558,1.0,0,,"05/01/2002: A package bomb exploded in front of a restaurant in Pereira, Colombia killing a woman and her young son. Authorities believed that either the Ejercito de Liberación Nacional (ELN) or the Urban Militias of the Fuerzas Armadas Revolucionarias de Colombia (FARC)were responsible for the attack. The bomb exploded when the mother attempted to defuse the package, which contained 2 kilograms of ammonium nitrate. No group claimed responsibility for the attack.",1,1,1,0,,,0,1,0,3,Bombing/Explosion,,,,,1,Business,2.0,Restaurant/Bar/Café,Business in Pereira,Restaurant,45.0,Colombia,,,,,,,,,,,,,,,,,National Liberation Army of Colombia (ELN),,,,,,Unknown,1.0,,,,0.0,0.0,,,,,,,,,,6,Explosives/Bombs/Dynamite,14.0,Time Fuse,,,,,,,,,,,,,The bomb was placed in a package.,2.0,0.0,0.0,0.0,0.0,0.0,-9,4.0,Unknown,,,0.0,,,,,,,,,,,,,,,,"Although members of the Ejercito de Liberación Nacional (ELN) were the primary suspects, authorities also believed that Fuerzas Armadas Revolucionarias de Colombia (FARC) could have perpetrated the bombing.","""Colombia: FARC-Paramilitary Confrontations Leave 60 Wounded in Choco,” El Tiempo, May 3, 2002",,,CETIS,0,0,0,0,
2715,24415,200205010012,2002,5,1,,0,,45,Colombia,3,South America,Guaviare,Calamar district,1.95846,-72.65231,3.0,0,,"05/01/2002: A bicycle bomb exploded killing two civilians and injuring two Colombian soldiers in Colombia's Calamar Municipality. The commander of Mobile Brigade No. 7, Colonel Jairo Rodriguez blamed the Fuerzas Armadas Revolucionarias de Colombia (FARC)for the attack. No group claimed responsibility for the attack.",1,1,1,0,,,0,1,0,3,Bombing/Explosion,,,,,4,Military,34.0,"Military Personnel (soldiers, troops, officers, forces)",Civilians,Civilians in Calamar Municipality,45.0,Colombia,4.0,Military,34.0,"Military Personnel (soldiers, troops, officers, forces)",Colombian Soldiers,Two Colombian soldiers stationed in Calamar Municipality,45.0,Colombia,,,,,,,,,Revolutionary Armed Forces of Colombia (FARC),,,,,,Unknown,1.0,,,,0.0,0.0,,,,,,,,,,6,Explosives/Bombs/Dynamite,15.0,Vehicle,,,,,,,,,,,,,Apparently some kind of bomb was planted on bicycle and it exploded.,2.0,0.0,0.0,2.0,0.0,0.0,-9,4.0,Unknown,,,0.0,,,,,,,,,,,,,,,,"Colombian Colonel, Jairo Rodriquez, accused the Fuerzas Armadas Revolucionarias de Colombia (FARC), but he offered no evidence to support his claim.","""Colombia: FARC-Paramilitary Confrontations Leave 60 Wounded in Choco,” El Tiempo, May 3, 2002",,,CETIS,0,0,0,0,
